line_id	entry_id	section	field	response	response_date	source	kernel_tokens_est	full_tokens_est	kernel	full
L0001	R001__NON_OBVIOUS_INSIGHTS__ITEM_01__L6	NON_OBVIOUS_INSIGHTS	item_01	1	6/22/2026, 4:17:51 AM	ai-prompting-and-description.md:L6	13	89	Prompting converts description into interface labor.	Prompting converts description into interface labor. The user is not merely expressing an image but reverse-engineering an opaque system: testing adjectives, observing failures and adapting language to undocumented model behavior. What appears to be revived literary practice is also unpaid usability work that helps normalize poorly legible interfaces.
L0002	R001__NON_OBVIOUS_INSIGHTS__ITEM_02__L10	NON_OBVIOUS_INSIGHTS	item_02	1	6/22/2026, 4:17:51 AM	ai-prompting-and-description.md:L10	22	85	The machine does not simply encourage richer description; it disciplines description.	The machine does not simply encourage richer description; it disciplines description. Users learn which words produce visible effects and gradually abandon distinctions the model cannot reliably render. Prompting therefore risks reshaping expressive language around machine-recognizable categories rather than expanding human sensitivity.
L0003	R001__NON_OBVIOUS_INSIGHTS__ITEM_03__L14	NON_OBVIOUS_INSIGHTS	item_03	1	6/22/2026, 4:17:51 AM	ai-prompting-and-description.md:L14	11	86	“Vibe” functions as a compression protocol.	“Vibe” functions as a compression protocol. Terms such as “cozy,” “cinematic,” or “melancholic” do not precisely describe atmosphere. They invoke bundles of visual conventions learned from training data. Prompt literacy may consequently become less like modernist observation and more like fluency in culturally standardized aesthetic presets.
L0004	R001__NON_OBVIOUS_INSIGHTS__ITEM_04__L18	NON_OBVIOUS_INSIGHTS	item_04	1	6/22/2026, 4:17:51 AM	ai-prompting-and-description.md:L18	18	92	The apparent democratization of writerly skill conceals a new hierarchy.	The apparent democratization of writerly skill conceals a new hierarchy. Advantage goes not necessarily to the most perceptive describer, but to the person who understands model-specific syntax, dominant visual references and iterative workflows. Literary competence, platform literacy and access to computation become entangled but are treated as the same ability.
L0005	R001__NON_OBVIOUS_INSIGHTS__ITEM_05__L22	NON_OBVIOUS_INSIGHTS	item_05	1	6/22/2026, 4:17:51 AM	ai-prompting-and-description.md:L22	16	87	Prompting relocates authorship from composition to selection.	Prompting relocates authorship from composition to selection. Because the model supplies details the user never articulated, the decisive creative act increasingly becomes judging, rejecting and steering outputs. The article frames prompting as descriptive writing but underexamines the curatorial labor that actually determines the final image.
L0006	R002__NON_OBVIOUS_INSIGHTS__ITEM_01__L81	NON_OBVIOUS_INSIGHTS	item_01	2	6/22/2026, 4:20:27 AM	ai-prompting-and-description.md:L81	16	104	Prompt engineering is being used as an epistemic escape hatch.	Prompt engineering is being used as an epistemic escape hatch. By arguing that bland results reflect weak prompting, the article makes almost any criticism of generative AI unfalsifiable. Whenever a model produces homogenized output, responsibility can be reassigned to the experimenter for failing to discover the right incantation. This protects the underlying system from evaluation under ordinary use conditions.
L0007	R002__NON_OBVIOUS_INSIGHTS__ITEM_02__L85	NON_OBVIOUS_INSIGHTS	item_02	2	6/22/2026, 4:20:27 AM	ai-prompting-and-description.md:L85	14	118	The argument quietly changes the object being tested.	The argument quietly changes the object being tested. Research claiming that models regress toward conventional or average outputs usually investigates the system’s default tendencies. The article responds by proposing intensive user intervention. But a highly engineered human-model workflow is not the same object as the model operating under normal prompting. Prompting may compensate for homogenization without disproving that homogenization is structurally present.
L0008	R002__NON_OBVIOUS_INSIGHTS__ITEM_03__L89	NON_OBVIOUS_INSIGHTS	item_03	2	6/22/2026, 4:20:27 AM	ai-prompting-and-description.md:L89	20	114	“Good prompting” transfers production costs from the model provider to the user.	“Good prompting” transfers production costs from the model provider to the user. The user must supply specificity, alternatives, exclusions, style constraints, evaluation criteria and repeated corrections. The apparent creative capacity of the model therefore depends partly on concealed human labor. Calling the result an AI capability blurs the distinction between what the system generates autonomously and what the user painstakingly extracts from it.
L0009	R002__NON_OBVIOUS_INSIGHTS__ITEM_04__L93	NON_OBVIOUS_INSIGHTS	item_04	2	6/22/2026, 4:20:27 AM	ai-prompting-and-description.md:L93	16	108	Prompt expertise creates a defensible professional jurisdiction.	Prompt expertise creates a defensible professional jurisdiction. The article does more than defend generative AI; it elevates prompt engineering as the missing specialist competence required to judge it properly. This establishes a gatekeeping structure in which critics without advanced prompting experience can be dismissed as methodologically naïve, while prompt consultants become necessary interpreters of system performance.
L0010	R002__NON_OBVIOUS_INSIGHTS__ITEM_05__L97	NON_OBVIOUS_INSIGHTS	item_05	2	6/22/2026, 4:20:27 AM	ai-prompting-and-description.md:L97	17	109	The “slop” debate is displaced from political economy to technique.	The “slop” debate is displaced from political economy to technique. Homogeneous AI content may result not only from prompting but from shared training corpora, optimization toward broadly acceptable responses, safety tuning, engagement incentives and the industrial scaling of cheap content. By centering user technique, the article turns a structural question about mass production into an individual question about operational skill.
L0011	R003__NON_OBVIOUS_INSIGHTS__ITEM_01__L156	NON_OBVIOUS_INSIGHTS	item_01	3	6/22/2026, 4:25:58 AM	ai-prompting-and-description.md:L156	20	114	AI does not eliminate the studio; it internalizes the studio inside one person.	AI does not eliminate the studio; it internalizes the studio inside one person. Bisbal occupies the roles of writer, art director, continuity editor, producer, sound editor, translator, archivist, developer, marketer, and franchise manager. The project appears to demonstrate production democratization, but it also demonstrates extreme role compression. What was once organizational coordination becomes continuous cognitive switching by a single creator.
L0012	R003__NON_OBVIOUS_INSIGHTS__ITEM_02__L160	NON_OBVIOUS_INSIGHTS	item_02	3	6/22/2026, 4:25:58 AM	ai-prompting-and-description.md:L160	21	106	The true productive asset is not generated content but the canon-management system.	The true productive asset is not generated content but the canon-management system. Images, voices, and prose are replaceable outputs. The durable infrastructure is the chronology, naming rules, civilization guides, character sheets, aesthetic constraints, wiki, and criteria governing inclusion. NUVAGAIA’s defensibility therefore lies less in its media artifacts than in the private ontology used to decide what belongs.
L0013	R003__NON_OBVIOUS_INSIGHTS__ITEM_03__L164	NON_OBVIOUS_INSIGHTS	item_03	3	6/22/2026, 4:25:58 AM	ai-prompting-and-description.md:L164	20	107	Transmedia becomes a discovery strategy before it becomes a storytelling form.	Transmedia becomes a discovery strategy before it becomes a storytelling form. The move from a fictional world to podcasts, images, videos, interactive fiction, and a wiki is framed creatively, but it also solves an attention-distribution problem. Each medium becomes an acquisition channel and entry point. The world is not merely expressed across formats; it is engineered to circulate through fragmented platform ecosystems.
L0014	R003__NON_OBVIOUS_INSIGHTS__ITEM_04__L168	NON_OBVIOUS_INSIGHTS	item_04	3	6/22/2026, 4:25:58 AM	ai-prompting-and-description.md:L168	20	103	The creator’s scarcity shifts from production capacity to editorial attention.	The creator’s scarcity shifts from production capacity to editorial attention. AI removes many constraints on generating additional lore, characters, images, and formats, but that makes selection, verification, continuity, and pruning more expensive. The central risk is no longer failing to produce enough material. It is producing more material than one person can meaningfully evaluate, integrate, or sustain.
L0015	R003__NON_OBVIOUS_INSIGHTS__ITEM_05__L172	NON_OBVIOUS_INSIGHTS	item_05	3	6/22/2026, 4:25:58 AM	ai-prompting-and-description.md:L172	16	119	Audience participation risks becoming unpaid canon production.	Audience participation risks becoming unpaid canon production. Interactive choices are incorporated into the official wiki rather than remaining peripheral engagement. This creates a mechanism through which audience activity can generate story direction, continuity events, and franchise value. The project may therefore move from participatory storytelling toward a governance problem: who has authority, ownership, credit, and veto power over collectively influenced canon?
L0016	R004__NON_OBVIOUS_INSIGHTS__ITEM_01__L235	NON_OBVIOUS_INSIGHTS	item_01	4	6/22/2026, 4:26:55 AM	ai-prompting-and-description.md:L235	29	119	The Odyssey defeats filmmakers because cinema externalizes what the poem keeps morally and ontologically unstable.	The Odyssey defeats filmmakers because cinema externalizes what the poem keeps morally and ontologically unstable. Homer can hold gods, weather, psychology, metaphor, and fate in suspension because language does not have to decide which level is literally real. Film must eventually choose: Athena is either a visible person, an atmospheric force, a psychological projection, or an absent cause. Each choice collapses the poem’s productive ambiguity into a cinematic ontology.
L0017	R004__NON_OBVIOUS_INSIGHTS__ITEM_02__L239	NON_OBVIOUS_INSIGHTS	item_02	4	6/22/2026, 4:26:55 AM	ai-prompting-and-description.md:L239	15	100	The deepest adaptation problem is not scale but legibility.	The deepest adaptation problem is not scale but legibility. The monsters, storms, and battles are technically producible. What is harder is making an ancient honor system intelligible without either endorsing it or translating it into contemporary morality. The more successfully a film explains Odysseus to a modern audience, the more likely it is to domesticate what makes him historically alien.
L0018	R004__NON_OBVIOUS_INSIGHTS__ITEM_03__L243	NON_OBVIOUS_INSIGHTS	item_03	4	6/22/2026, 4:26:55 AM	ai-prompting-and-description.md:L243	16	118	The article treats audience maturity as a production constraint.	The article treats audience maturity as a production constraint. Nolan’s problem is not merely whether he can portray cruelty without moral simplification; it is whether a blockbuster audience trained by franchise storytelling can tolerate identification without exoneration. The adaptation therefore tests not only a director’s skill but the commercial cinema’s capacity to sustain attachment to a protagonist who cannot be sorted into hero, villain, victim, or antihero.
L0019	R004__NON_OBVIOUS_INSIGHTS__ITEM_04__L247	NON_OBVIOUS_INSIGHTS	item_04	4	6/22/2026, 4:26:55 AM	ai-prompting-and-description.md:L247	23	119	“Faithfulness” is exposed as an institutional fiction rather than an artistic possibility.	“Faithfulness” is exposed as an institutional fiction rather than an artistic possibility. The poem itself emerged through performance, recombination, editorial stabilization, translation, and ideological reframing. The supposedly original Odyssey is already the result of repeated adaptation. What later filmmakers violate is therefore not a pure source but a canon whose authority was manufactured by bards, tyrants, librarians, translators, and educational institutions.
L0020	R004__NON_OBVIOUS_INSIGHTS__ITEM_05__L251	NON_OBVIOUS_INSIGHTS	item_05	4	6/22/2026, 4:26:55 AM	ai-prompting-and-description.md:L251	15	104	The body becomes cinema’s substitute for poetic authority.	The body becomes cinema’s substitute for poetic authority. Where Homer establishes grandeur through rhythm, simile, invocation, and formula, film repeatedly resorts to landscapes, musculature, suffering, nudity, and physical transformation. The increasingly disciplined bodies of performers reveal a compensatory logic: when the medium cannot reproduce epic language, it tries to make the human body carry the aura.
L0021	R005__NON_OBVIOUS_INSIGHTS__ITEM_01__L314	NON_OBVIOUS_INSIGHTS	item_01	5	6/22/2026, 4:30:57 AM	ai-prompting-and-description.md:L314	24	118	The “reverse centaur” is less a description of automation than a theory of managerial control.	The “reverse centaur” is less a description of automation than a theory of managerial control. The machine’s technical capability does not determine whether workers gain autonomy or lose it. That outcome is decided by who controls workflow design, performance metrics, staffing levels, and error liability. AI’s central political function is therefore not replacing labor directly, but giving management a new justification for reorganizing labor around machine demands.
L0022	R005__NON_OBVIOUS_INSIGHTS__ITEM_02__L318	NON_OBVIOUS_INSIGHTS	item_02	5	6/22/2026, 4:30:57 AM	ai-prompting-and-description.md:L318	16	98	The AI bubble is collateralized by hypothetical unpaid wages.	The AI bubble is collateralized by hypothetical unpaid wages. Valuations depend on converting imagined future labor displacement into present financial value. Workers do not have to be successfully replaced for executives and investors to profit; they need only remain plausibly replaceable. The threat of automation can discipline wages and working conditions before the automation works.
L0023	R005__NON_OBVIOUS_INSIGHTS__ITEM_03__L322	NON_OBVIOUS_INSIGHTS	item_03	5	6/22/2026, 4:30:57 AM	ai-prompting-and-description.md:L322	11	98	Failure may still be commercially useful.	Failure may still be commercially useful. Even when AI systems underperform, their deployment can weaken departments, eliminate institutional memory, intensify surveillance, and redefine skilled work as routine verification. Rehiring employees later does not necessarily restore the earlier profession. A failed automation project can permanently degrade the occupation it failed to replace.
L0024	R005__NON_OBVIOUS_INSIGHTS__ITEM_04__L326	NON_OBVIOUS_INSIGHTS	item_04	5	6/22/2026, 4:30:57 AM	ai-prompting-and-description.md:L326	22	113	Public outrage and public adoption are not opposites within the investment narrative.	Public outrage and public adoption are not opposites within the investment narrative. Enthusiasm proves demand, while fear proves disruptive power. Criticism that emphasizes mass replacement, creative annihilation, or unstoppable intelligence can inadvertently validate the industry’s core claim that AI is historically inevitable and economically transformative. The industry can metabolize both fascination and resistance as evidence of importance.
L0025	R005__NON_OBVIOUS_INSIGHTS__ITEM_05__L330	NON_OBVIOUS_INSIGHTS	item_05	5	6/22/2026, 4:30:57 AM	ai-prompting-and-description.md:L330	20	108	The consumer is being repositioned as an investor-facing performance indicator.	The consumer is being repositioned as an investor-facing performance indicator. Free or subsidized chatbot use may matter less as revenue than as visible behavioral evidence presented to markets, boards, and governments. Usage statistics become a theatrical proxy for durable demand, even when users dislike the technology, use it only because it has been bundled into existing services, or derive little measurable value from it.
L0026	R006__NON_OBVIOUS_INSIGHTS__ITEM_01__L393	NON_OBVIOUS_INSIGHTS	item_01	6	6/22/2026, 4:34:25 AM	ai-prompting-and-description.md:L393	27	126	The dispute is not really about model capability; it is about who gets to define the meaning of an action.	The dispute is not really about model capability; it is about who gets to define the meaning of an action. “Fix this code” can be classified as routine defensive maintenance, vulnerability exploitation, dual-use technical assistance, or an exportable weapons capability depending on the institutional observer. The same output changes political identity without changing technical substance. Control therefore shifts toward whoever owns the classification regime, not whoever best understands the code.
L0027	R006__NON_OBVIOUS_INSIGHTS__ITEM_02__L397	NON_OBVIOUS_INSIGHTS	item_02	6	6/22/2026, 4:34:25 AM	ai-prompting-and-description.md:L397	22	134	Safety refusal can become evidence of regulatory danger rather than evidence of safety.	Safety refusal can become evidence of regulatory danger rather than evidence of safety. Fable 5 reportedly refused the explicit security-review request but complied with a less specialized repair instruction. This suggests that guardrails may regulate wording more reliably than capability. The stronger political conclusion, however, was not that the guardrail design was superficial; it was that the underlying model was too dangerous to distribute. A failed interface policy was reinterpreted as a geopolitical property of the model.
L0028	R006__NON_OBVIOUS_INSIGHTS__ITEM_03__L401	NON_OBVIOUS_INSIGHTS	item_03	6	6/22/2026, 4:34:25 AM	ai-prompting-and-description.md:L401	20	121	The restrictions convert domestic compliance into a competitive disadvantage.	The restrictions convert domestic compliance into a competitive disadvantage. Closed American providers can be compelled to disable models globally, while open-weight and foreign systems remain beyond the same enforcement mechanism. Regulation aimed at suppressing capability may therefore redirect demand, expertise, and training data toward less governable alternatives. The intervention can weaken the actors most available for oversight while preserving the capability elsewhere.
L0029	R006__NON_OBVIOUS_INSIGHTS__ITEM_04__L405	NON_OBVIOUS_INSIGHTS	item_04	6	6/22/2026, 4:34:25 AM	ai-prompting-and-description.md:L405	26	112	The government’s action creates a “defender’s asymmetry” before establishing an attacker’s asymmetry.	The government’s action creates a “defender’s asymmetry” before establishing an attacker’s asymmetry. Legitimate defenders depend on authorized access, procurement, documentation, collaboration, and legal clarity. Attackers are less constrained by export rules and can use leaked, open, stolen, or foreign systems. Restrictions therefore bind the institutionally compliant side first, even when the policy is justified as preventing hostile use.
L0030	R006__NON_OBVIOUS_INSIGHTS__ITEM_05__L409	NON_OBVIOUS_INSIGHTS	item_05	6	6/22/2026, 4:34:25 AM	ai-prompting-and-description.md:L409	31	134	The episode reveals that AI security governance is being built around demonstrations rather than validated threat models.	The episode reveals that AI security governance is being built around demonstrations rather than validated threat models. A small prompt sequence appears to have acquired policy significance because it was narratively legible: a model refused, then produced useful security code after rephrasing. That makes for a vivid “bypass” story, but it does not establish marginal offensive capability, operational scalability, attacker advantage, or national-security impact. Spectacular examples can substitute for comparative risk analysis.
L0031	R007__NON_OBVIOUS_INSIGHTS__ITEM_01__L472	NON_OBVIOUS_INSIGHTS	item_01	7	6/22/2026, 4:44:37 AM	ai-prompting-and-description.md:L472	18	130	Neural CAD converts Autodesk’s interface monopoly into a model monopoly.	Neural CAD converts Autodesk’s interface monopoly into a model monopoly. Traditional CAD power came from controlling commands, file formats, and professional workflows. Natural-language and sketch-based interaction may weaken dependence on menus, but it increases dependence on Autodesk’s hidden interpretation layer: the foundation model that decides how an imprecise intention becomes geometry. The interface becomes easier while the governing infrastructure becomes less inspectable and potentially harder to leave.
L0032	R007__NON_OBVIOUS_INSIGHTS__ITEM_02__L476	NON_OBVIOUS_INSIGHTS	item_02	7	6/22/2026, 4:44:37 AM	ai-prompting-and-description.md:L476	18	116	The promised democratization may shift expertise rather than remove it.	The promised democratization may shift expertise rather than remove it. Neural CAD reduces the need to remember commands, but someone must still recognize impossible assemblies, unsafe structures, manufacturing conflicts, and misleading optimizations. As execution becomes easier, more users may produce plausible professional geometry without possessing the tacit knowledge required to judge it. The scarcity moves from model construction to model verification.
L0033	R007__NON_OBVIOUS_INSIGHTS__ITEM_03__L480	NON_OBVIOUS_INSIGHTS	item_03	7	6/22/2026, 4:44:37 AM	ai-prompting-and-description.md:L480	24	120	Editable geometry is also a mechanism for absorbing AI output into existing liability systems.	Editable geometry is also a mechanism for absorbing AI output into existing liability systems. Producing B-reps, parameters, constraints, and command histories does more than improve usability. It makes probabilistic generation look like conventional engineering work product. Once an output enters an ordinary CAD history, responsibility can migrate toward the professional who accepted or modified it, even when the foundational design decisions originated in an opaque model.
L0034	R007__NON_OBVIOUS_INSIGHTS__ITEM_04__L484	NON_OBVIOUS_INSIGHTS	item_04	7	6/22/2026, 4:44:37 AM	ai-prompting-and-description.md:L484	30	120	Autodesk is positioning customer history as both the source of future differentiation and the basis of deeper lock-in.	Autodesk is positioning customer history as both the source of future differentiation and the basis of deeper lock-in. Fine-tuning models on proprietary designs and workflows appears to let firms preserve institutional expertise. But once that expertise is encoded on top of Autodesk’s foundation models, changing vendors may mean abandoning not just software files but an accumulated organizational intelligence layer. Historical practice becomes a subscription-dependent asset.
L0035	R007__NON_OBVIOUS_INSIGHTS__ITEM_05__L488	NON_OBVIOUS_INSIGHTS	item_05	7	6/22/2026, 4:44:37 AM	ai-prompting-and-description.md:L488	16	124	Neural CAD could standardize design before it visibly copies it.	Neural CAD could standardize design before it visibly copies it. “Anti-parroting” focuses on preventing close resemblance to individual designs. Yet homogenization can occur at a higher level through repeated preference for familiar topologies, manufacturable conventions, benchmark-friendly solutions, and common optimization targets. A system may never duplicate a proprietary object while still narrowing the profession’s design imagination around the statistical center of its training data.
L0036	R008__NON_OBVIOUS_INSIGHTS__ITEM_01__L551	NON_OBVIOUS_INSIGHTS	item_01	8	6/22/2026, 4:53:25 AM	ai-prompting-and-description.md:L551	30	134	“The backbone of AI” is being rhetorically expanded until it includes nearly every asset class surrounding computation.	“The backbone of AI” is being rhetorically expanded until it includes nearly every asset class surrounding computation. The article begins with neural architectures, shifts to cloud providers, then electricity, data centers, matrix multiplication, mathematics, supply chains, and construction speed. This ambiguity is strategically useful: almost any infrastructure investment can be presented as indispensable to AI, allowing vendors and investors to attach themselves to the boom without demonstrating direct model-level advantage.
L0037	R008__NON_OBVIOUS_INSIGHTS__ITEM_02__L555	NON_OBVIOUS_INSIGHTS	item_02	8	6/22/2026, 4:53:25 AM	ai-prompting-and-description.md:L555	29	124	The binding constraint is moving from semiconductor performance to institutional permission and physical delivery.	The binding constraint is moving from semiconductor performance to institutional permission and physical delivery. The revealing detail is not that a component’s lead time fell from more than one hundred weeks to twenty-two. It is that schedule commitments now justify bypassing ordinary suppliers and vertically integrating production. AI infrastructure is becoming an emergency procurement regime in which speed can override established market coordination, planning norms, and deliberation.
L0038	R008__NON_OBVIOUS_INSIGHTS__ITEM_03__L559	NON_OBVIOUS_INSIGHTS	item_03	8	6/22/2026, 4:53:25 AM	ai-prompting-and-description.md:L559	28	120	Energy scarcity is being reframed as an opportunity to expand supply rather than a reason to discipline demand.	Energy scarcity is being reframed as an opportunity to expand supply rather than a reason to discipline demand. The projected electricity burden does not lead the participants toward limits, allocation rules, or proof of social value. Instead, increased consumption becomes a rationale for building more generation and infrastructure. AI demand is thus treated as presumptively legitimate, while households, public institutions, and climate goals are expected to adjust around it.
