line_id	entry_id	section	field	response	response_date	source	kernel_tokens_est	full_tokens_est	kernel	full
L0650	R129__NON_OBVIOUS_INSIGHTS__ITEM_01__L12539	NON_OBVIOUS_INSIGHTS	item_01	129	6/28/2026, 5:29:39 AM	ai-prompting-and-description.md:L12539	19	64	The quote distinguishes wrongdoing from the destruction of moral reality.	The quote distinguishes wrongdoing from the destruction of moral reality. A person who admits a bad act leaves the act visible and therefore contestable. A deceiver attempts to control not only what happened but what others are permitted to know happened.
L0651	R129__NON_OBVIOUS_INSIGHTS__ITEM_02__L12543	NON_OBVIOUS_INSIGHTS	item_02	129	6/28/2026, 5:29:39 AM	ai-prompting-and-description.md:L12543	14	63	The deeper vice is bad faith, not factual inaccuracy.	The deeper vice is bad faith, not factual inaccuracy. Deception allows a person to preserve a flattering self-image while continuing harmful conduct. The lie protects the wrongdoer from the internal consequences of recognizing what they have become.
L0652	R129__NON_OBVIOUS_INSIGHTS__ITEM_03__L12547	NON_OBVIOUS_INSIGHTS	item_03	129	6/28/2026, 5:29:39 AM	ai-prompting-and-description.md:L12547	14	70	Confession preserves the possibility of relationship.	Confession preserves the possibility of relationship. Truth does not erase injury, but it gives the injured person enough reality to judge, refuse, forgive, negotiate, or leave. Deception steals those choices by manipulating the conditions under which consent and trust operate.
L0653	R129__NON_OBVIOUS_INSIGHTS__ITEM_04__L12551	NON_OBVIOUS_INSIGHTS	item_04	129	6/28/2026, 5:29:39 AM	ai-prompting-and-description.md:L12551	15	52	The quote opposes hypocrisy more directly than immorality.	The quote opposes hypocrisy more directly than immorality. “Be bad” is not permission to harm. It is a deliberately shocking way of saying that visible vice is less corrosive than vice disguised as virtue.
L0654	R129__NON_OBVIOUS_INSIGHTS__ITEM_05__L12555	NON_OBVIOUS_INSIGHTS	item_05	129	6/28/2026, 5:29:39 AM	ai-prompting-and-description.md:L12555	14	58	Lying creates a second injury layered over the first.	Lying creates a second injury layered over the first. The original act damages another person; the deception then recruits that person into a false account of their own experience. Betrayal becomes epistemic as well as emotional.
L0655	R129__NON_OBVIOUS_INSIGHTS__ITEM_06__L12559	NON_OBVIOUS_INSIGHTS	item_06	129	6/28/2026, 5:29:39 AM	ai-prompting-and-description.md:L12559	10	65	The formulation rejects moral branding.	The formulation rejects moral branding. Tolstoy’s characters frequently struggle not only with what they do but with the stories through which they declare themselves respectable, loving, rational, or innocent. The self-description becomes part of the offense.
L0656	R130__NON_OBVIOUS_INSIGHTS__ITEM_01__L12662	NON_OBVIOUS_INSIGHTS	item_01	130	6/28/2026, 5:31:04 AM	ai-prompting-and-description.md:L12662	33	102	The study’s strongest implication is not that laughter became language, but that speech may have inherited an older timing machine.	The study’s strongest implication is not that laughter became language, but that speech may have inherited an older timing machine. Before humans could organize words, their ancestors may already have possessed mechanisms for coordinating breath, vocal bursts, pauses, and social response. Language could therefore be an elaboration of preexisting rhythmic control rather than an entirely new vocal faculty.
L0657	R130__NON_OBVIOUS_INSIGHTS__ITEM_02__L12666	NON_OBVIOUS_INSIGHTS	item_02	130	6/28/2026, 5:31:04 AM	ai-prompting-and-description.md:L12666	23	97	Laughter offers evidence about communication because it sits between reflex and performance.	Laughter offers evidence about communication because it sits between reflex and performance. Tickling and play can trigger involuntary vocalization, yet humans also time laughter strategically during conversation. The same behavior spans automatic physiology and socially controlled signaling, making it a plausible bridge between inherited vocal response and intentional communication.
L0658	R130__NON_OBVIOUS_INSIGHTS__ITEM_03__L12670	NON_OBVIOUS_INSIGHTS	item_03	130	6/28/2026, 5:31:04 AM	ai-prompting-and-description.md:L12670	12	80	The conserved feature is rhythm, not meaning.	The conserved feature is rhythm, not meaning. The apes are not necessarily expressing equivalent intentions or possessing proto-sentences. What appears shared is the temporal architecture through which vocal events are segmented. Evolution may preserve the carrier structure long before new semantic functions occupy it.
L0659	R130__NON_OBVIOUS_INSIGHTS__ITEM_04__L12674	NON_OBVIOUS_INSIGHTS	item_04	130	6/28/2026, 5:31:04 AM	ai-prompting-and-description.md:L12674	17	78	Human distinctiveness appears as plasticity layered over continuity.	Human distinctiveness appears as plasticity layered over continuity. The article does not support a clean rupture between animal vocalization and human speech. Humans share a basic rhythmic substrate with other great apes, then exhibit greater speed, variability, contextual modulation, and voluntary control.
L0660	R130__NON_OBVIOUS_INSIGHTS__ITEM_05__L12678	NON_OBVIOUS_INSIGHTS	item_05	130	6/28/2026, 5:31:04 AM	ai-prompting-and-description.md:L12678	15	78	Play may have been a training ground for vocal flexibility.	Play may have been a training ground for vocal flexibility. Rough-and-tumble interaction repeatedly demands prediction, turn-taking, inhibition, escalation, and repair. Laughter coordinates these unstable encounters. A vocal system refined in play could later support more deliberate forms of social sequencing.
L0661	R130__NON_OBVIOUS_INSIGHTS__ITEM_06__L12682	NON_OBVIOUS_INSIGHTS	item_06	130	6/28/2026, 5:31:04 AM	ai-prompting-and-description.md:L12682	20	72	Laughter is not merely an emotional output; it is an interactional regulator.	Laughter is not merely an emotional output; it is an interactional regulator. A laugh can signal safety, affiliation, submission, tension, irony, embarrassment, or invitation. Its evolutionary importance may lie less in expressing amusement than in managing uncertainty between bodies.
L0662	R130__NON_OBVIOUS_INSIGHTS__ITEM_07__L12686	NON_OBVIOUS_INSIGHTS	item_07	130	6/28/2026, 5:31:04 AM	ai-prompting-and-description.md:L12686	33	78	The research shifts the origin-of-language question from “When did speech appear?” to “Which capacities were gradually repurposed?”	The research shifts the origin-of-language question from “When did speech appear?” to “Which capacities were gradually repurposed?” Respiratory control, rhythm, turn-taking, imitation, contextual flexibility, and social prediction may each have separate evolutionary histories that later converged in language.
L0663	R131__NON_OBVIOUS_INSIGHTS__ITEM_01__L12811	NON_OBVIOUS_INSIGHTS	item_01	131	6/28/2026, 5:31:42 AM	ai-prompting-and-description.md:L12811	24	75	The article translates an organizational conflict problem into an individual attention problem.	The article translates an organizational conflict problem into an individual attention problem. Instead of first asking whether workers face poor management, unsafe conditions, impossible workloads, or blocked authority, it asks whether their brains have become too practiced at noticing negativity.
L0664	R131__NON_OBVIOUS_INSIGHTS__ITEM_02__L12815	NON_OBVIOUS_INSIGHTS	item_02	131	6/28/2026, 5:31:42 AM	ai-prompting-and-description.md:L12815	23	79	“Complaint” is treated as both perception and speech, but these are different mechanisms.	“Complaint” is treated as both perception and speech, but these are different mechanisms. A person may notice defects accurately, express them repeatedly, or fail to convert them into action. Attention bias, emotional regulation, communication design, and institutional power should not be collapsed into one habit.
L0665	R131__NON_OBVIOUS_INSIGHTS__ITEM_03__L12819	NON_OBVIOUS_INSIGHTS	item_03	131	6/28/2026, 5:31:42 AM	ai-prompting-and-description.md:L12819	24	86	The neuroscience language gives managerial preference the appearance of biological necessity.	The neuroscience language gives managerial preference the appearance of biological necessity. “Neurons that fire together wire together” is used to move from a broad fact about plasticity to a much stronger claim: repeated complaining trains a stable negative orientation. The metaphor supplies authority beyond what the article demonstrates.
L0666	R131__NON_OBVIOUS_INSIGHTS__ITEM_04__L12823	NON_OBVIOUS_INSIGHTS	item_04	131	6/28/2026, 5:31:42 AM	ai-prompting-and-description.md:L12823	26	72	The real useful distinction is not positive versus negative thinking, but diagnosis versus rumination.	The real useful distinction is not positive versus negative thinking, but diagnosis versus rumination. Productive criticism identifies a condition, locates causes, names responsibility, and opens an action path. Rumination repeats distress without changing the model or the environment.
L0667	R131__NON_OBVIOUS_INSIGHTS__ITEM_05__L12827	NON_OBVIOUS_INSIGHTS	item_05	131	6/28/2026, 5:31:42 AM	ai-prompting-and-description.md:L12827	12	81	Complaint can function as distributed sensing.	Complaint can function as distributed sensing. Repeated grievances may reveal defects that formal dashboards miss: workload pressure, harassment, unsafe routines, customer harm, administrative absurdity, or leadership blind spots. Eliminating the signal can make the organization feel calmer while becoming less informed.
L0668	R131__NON_OBVIOUS_INSIGHTS__ITEM_06__L12831	NON_OBVIOUS_INSIGHTS	item_06	131	6/28/2026, 5:31:42 AM	ai-prompting-and-description.md:L12831	9	64	Emotional contagion cuts both ways.	Emotional contagion cuts both ways. Chronic pessimism can narrow collective imagination, but compulsory optimism can spread denial, silence, and fear. A leader who refuses bad news changes the emotional climate as surely as one who broadcasts frustration.
L0669	R131__NON_OBVIOUS_INSIGHTS__ITEM_07__L12835	NON_OBVIOUS_INSIGHTS	item_07	131	6/28/2026, 5:31:42 AM	ai-prompting-and-description.md:L12835	24	72	The article’s practical insight is that attention is trainable, but it overstates the target.	The article’s practical insight is that attention is trainable, but it overstates the target. The stronger intervention is not training people to notice fewer problems. It is training them to notice problems, opportunities, causal structure, available leverage, and limits simultaneously.
L0670	R132__NON_OBVIOUS_INSIGHTS__ITEM_01__L13006	NON_OBVIOUS_INSIGHTS	item_01	132	6/28/2026, 5:33:29 AM	ai-prompting-and-description.md:L13006	21	92	The real shift is from sequential commitment to iterative constraint satisfaction.	The real shift is from sequential commitment to iterative constraint satisfaction. An autoregressive model commits to one token and then conditions the future on that commitment. A masked diffusion model repeatedly proposes a global configuration and repairs uncertain regions. Text generation becomes closer to solving a changing crossword than extending a sentence.
L0671	R132__NON_OBVIOUS_INSIGHTS__ITEM_02__L13010	NON_OBVIOUS_INSIGHTS	item_02	132	6/28/2026, 5:33:29 AM	ai-prompting-and-description.md:L13010	18	86	DLM speed comes from exchanging temporal depth for computational width.	DLM speed comes from exchanging temporal depth for computational width. Many token positions can be predicted during one model pass, but every refinement round may process the entire sequence. The architecture can reduce wall-clock latency on highly parallel hardware without necessarily reducing total computation, memory traffic, or energy.
L0672	R132__NON_OBVIOUS_INSIGHTS__ITEM_03__L13014	NON_OBVIOUS_INSIGHTS	item_03	132	6/28/2026, 5:33:29 AM	ai-prompting-and-description.md:L13014	15	77	The unmasking schedule becomes a hidden planning mechanism.	The unmasking schedule becomes a hidden planning mechanism. Deciding which tokens are stable, which remain uncertain, and which should be reconsidered determines the order in which the answer takes shape. “Confidence” is therefore not merely a score; it allocates the model’s future computational attention.
L0673	R132__NON_OBVIOUS_INSIGHTS__ITEM_04__L13018	NON_OBVIOUS_INSIGHTS	item_04	132	6/28/2026, 5:33:29 AM	ai-prompting-and-description.md:L13018	18	95	Bidirectional generation removes the privileged status of the beginning.	Bidirectional generation removes the privileged status of the beginning. A word near the end can immediately constrain a word near the start. LLaDA models use masked corruption and reverse token prediction, while newer iLLaDA work keeps the diffusion objective through training with fully bidirectional attention. ([arXiv](https://arxiv.org/abs/2502.09992?utm_source=chatgpt.com))
L0674	R132__NON_OBVIOUS_INSIGHTS__ITEM_05__L13022	NON_OBVIOUS_INSIGHTS	item_05	132	6/28/2026, 5:33:29 AM	ai-prompting-and-description.md:L13022	15	87	DLMs expose output length as part of the generative problem.	DLMs expose output length as part of the generative problem. Autoregressive models can stop when they produce an end token. A fully masked sequence must usually begin with some estimate of how many positions exist. Length prediction, padding, block generation, or variable-length refinement therefore becomes a first-class architectural decision.
L0675	R132__NON_OBVIOUS_INSIGHTS__ITEM_06__L13026	NON_OBVIOUS_INSIGHTS	item_06	132	6/28/2026, 5:33:29 AM	ai-prompting-and-description.md:L13026	21	65	The strongest natural use cases may be editing rather than blank-page generation.	The strongest natural use cases may be editing rather than blank-page generation. Infilling, constrained rewriting, code repair, document revision, and maintaining required phrases align naturally with a system that repeatedly edits a partially fixed object.
L0676	R132__NON_OBVIOUS_INSIGHTS__ITEM_07__L13030	NON_OBVIOUS_INSIGHTS	item_07	132	6/28/2026, 5:33:29 AM	ai-prompting-and-description.md:L13030	23	83	The likely endpoint is not diffusion replacing autoregression but representation routing.	The likely endpoint is not diffusion replacing autoregression but representation routing. Some segments may benefit from fast parallel drafting; others require precise sequential commitment, tool use, verification, or open-ended continuation. Hybrid decoders can allocate different generation regimes to different parts of a task.
L0677	R133__NON_OBVIOUS_INSIGHTS__ITEM_01__L13163	NON_OBVIOUS_INSIGHTS	item_01	133	6/28/2026, 5:35:13 AM	ai-prompting-and-description.md:L13163	24	89	The shift from chatbots to world models is really a shift from representation to intervention.	The shift from chatbots to world models is really a shift from representation to intervention. Language models produce descriptions, plans, and code. Physical systems must cause events in environments where errors consume time, energy, property, and sometimes human safety. Intelligence becomes accountable to consequences rather than textual plausibility.
L0678	R133__NON_OBVIOUS_INSIGHTS__ITEM_02__L13167	NON_OBVIOUS_INSIGHTS	item_02	133	6/28/2026, 5:35:13 AM	ai-prompting-and-description.md:L13167	20	76	A world model is less a picture of reality than a machine for counterfactuals.	A world model is less a picture of reality than a machine for counterfactuals. Its decisive function is not recognizing what exists, but estimating what will happen if an agent pushes, turns, waits, accelerates, or chooses another route. Prediction becomes useful only when coupled to possible action.
L0679	R133__NON_OBVIOUS_INSIGHTS__ITEM_03__L13171	NON_OBVIOUS_INSIGHTS	item_03	133	6/28/2026, 5:35:13 AM	ai-prompting-and-description.md:L13171	18	84	The article identifies three separate businesses hiding under one label.	The article identifies three separate businesses hiding under one label. Renderers sell believable appearance. Simulators sell reliable training environments. Planners sell action selection. These systems may share techniques, but they optimize for incompatible truths: visual plausibility, physical fidelity, and decision usefulness.
L0680	R133__NON_OBVIOUS_INSIGHTS__ITEM_04__L13175	NON_OBVIOUS_INSIGHTS	item_04	133	6/28/2026, 5:35:13 AM	ai-prompting-and-description.md:L13175	17	80	Embodied AI reverses the informational advantage of the internet.	Embodied AI reverses the informational advantage of the internet. Language models benefited from enormous stores of digitized text. Physical intelligence needs data about contact, force, failure, occlusion, delay, object permanence, and recovery—information that is expensive to collect and poorly represented online.
L0681	R133__NON_OBVIOUS_INSIGHTS__ITEM_05__L13179	NON_OBVIOUS_INSIGHTS	item_05	133	6/28/2026, 5:35:13 AM	ai-prompting-and-description.md:L13179	15	77	Simulation becomes a labor substitute before robotics does.	Simulation becomes a labor substitute before robotics does. The immediate economic value may lie in replacing costly physical experimentation, data collection, game-world construction, weather modeling, and robot training with generated environments—even before autonomous machines become broadly competent.
L0682	R133__NON_OBVIOUS_INSIGHTS__ITEM_06__L13183	NON_OBVIOUS_INSIGHTS	item_06	133	6/28/2026, 5:35:13 AM	ai-prompting-and-description.md:L13183	22	90	The move toward specialized world-model hardware suggests architecture fragmentation.	The move toward specialized world-model hardware suggests architecture fragmentation. If spatial-temporal prediction has different computational demands from token generation, the current concentration around one general-purpose model architecture may weaken. The AI stack could separate into language, perception, simulation, planning, and control systems.
L0683	R133__NON_OBVIOUS_INSIGHTS__ITEM_07__L13187	NON_OBVIOUS_INSIGHTS	item_07	133	6/28/2026, 5:35:13 AM	ai-prompting-and-description.md:L13187	15	84	Interaction is becoming a stronger benchmark than realism.	Interaction is becoming a stronger benchmark than realism. A beautiful generated video can avoid exposing whether its world remains stable. The moment a user opens a door, moves an object, leaves, and returns, the system must preserve causality, geometry, state, and consequences. Agency turns visual defects into structural failures.
L0684	R134__NON_OBVIOUS_INSIGHTS__ITEM_01__L13320	NON_OBVIOUS_INSIGHTS	item_01	134	6/28/2026, 5:42:38 AM	ai-prompting-and-description.md:L13320	19	81	The early experiments manipulated fatalism more than free-will scepticism.	The early experiments manipulated fatalism more than free-will scepticism. Telling participants that conscious thought is powerless and behavior cannot change attacks agency, efficacy, and motivation simultaneously. Any resulting cheating or aggression cannot cleanly be attributed to disbelief in metaphysical free will.
L0685	R134__NON_OBVIOUS_INSIGHTS__ITEM_02__L13324	NON_OBVIOUS_INSIGHTS	item_02	134	6/28/2026, 5:42:38 AM	ai-prompting-and-description.md:L13324	17	72	The debate depends on separating agency from ultimate authorship.	The debate depends on separating agency from ultimate authorship. A person can deliberate, respond to reasons, learn, and alter behavior without being the uncaused creator of their character, desires, or circumstances. Much of the psychological literature collapses these distinct claims.
L0686	R134__NON_OBVIOUS_INSIGHTS__ITEM_03__L13328	NON_OBVIOUS_INSIGHTS	item_03	134	6/28/2026, 5:42:38 AM	ai-prompting-and-description.md:L13328	17	69	Belief in free will may operate as a social attribution technology.	Belief in free will may operate as a social attribution technology. It helps institutions decide who deserves praise, blame, punishment, reward, poverty, or exclusion. The practical stakes concern not only personal motivation but how societies distribute moral responsibility.
L0687	R134__NON_OBVIOUS_INSIGHTS__ITEM_04__L13332	NON_OBVIOUS_INSIGHTS	item_04	134	6/28/2026, 5:42:38 AM	ai-prompting-and-description.md:L13332	27	101	The harmful experimental effect may come from narrative destabilization rather than philosophical content.	The harmful experimental effect may come from narrative destabilization rather than philosophical content. A brief passage telling participants that their choices are illusory can temporarily undermine the practical self-model through which they ordinarily act. Long-term sceptics have usually integrated their view into a coherent moral framework and therefore need not experience the same disruption.
L0688	R134__NON_OBVIOUS_INSIGHTS__ITEM_05__L13336	NON_OBVIOUS_INSIGHTS	item_05	134	6/28/2026, 5:42:38 AM	ai-prompting-and-description.md:L13336	20	65	The article exposes a category error between induced state and stable worldview.	The article exposes a category error between induced state and stable worldview. A momentary manipulation is not equivalent to a considered philosophical commitment. Comparing the two resembles confusing acute disorientation with an established belief system.
L0689	R134__NON_OBVIOUS_INSIGHTS__ITEM_06__L13340	NON_OBVIOUS_INSIGHTS	item_06	134	6/28/2026, 5:42:38 AM	ai-prompting-and-description.md:L13340	17	63	Free-will scepticism does not eliminate causation through reasons.	Free-will scepticism does not eliminate causation through reasons. Advice, incentives, education, therapy, and punishment can still influence behavior in a determined world. Rejecting ultimate moral desert does not imply that interventions are useless.
L0690	R134__NON_OBVIOUS_INSIGHTS__ITEM_07__L13344	NON_OBVIOUS_INSIGHTS	item_07	134	6/28/2026, 5:42:38 AM	ai-prompting-and-description.md:L13344	20	81	The strongest social consequence may be a shift from retribution to prevention.	The strongest social consequence may be a shift from retribution to prevention. Without ultimate desert, institutions can still restrain dangerous people, protect others, rehabilitate offenders, and shape future behavior. What weakens is the justification for suffering imposed merely because someone supposedly deserves it.
L0691	R134__NON_OBVIOUS_INSIGHTS__ITEM_08__L13348	NON_OBVIOUS_INSIGHTS	item_08	134	6/28/2026, 5:42:38 AM	ai-prompting-and-description.md:L13348	24	65	The article suggests that meaning may depend more on participation than metaphysical authorship.	The article suggests that meaning may depend more on participation than metaphysical authorship. Achievements can matter because a person enacted effort, commitment, and relationship—even when the causes of that person’s capacities extend beyond their control.
L0692	R135__NON_OBVIOUS_INSIGHTS__ITEM_01__L13502	NON_OBVIOUS_INSIGHTS	item_01	135	6/28/2026, 5:51:21 AM	ai-prompting-and-description.md:L13502	18	77	The decisive inversion is from policy learning to environment learning.	The decisive inversion is from policy learning to environment learning. Most agent research asks, “Given this state, what action should come next?” Qwen-AgentWorld asks, “Given this action, what state should come next?” This separates knowledge of how a world behaves from the policy used to act within it.
L0693	R135__NON_OBVIOUS_INSIGHTS__ITEM_02__L13506	NON_OBVIOUS_INSIGHTS	item_02	135	6/28/2026, 5:51:21 AM	ai-prompting-and-description.md:L13506	15	94	The world model becomes an executable curriculum designer.	The world model becomes an executable curriculum designer. Its main value is not merely reproducing ordinary environment responses. It can manufacture rare failures, incomplete outputs, broken dependencies, low-resource conditions, and misleading intermediate states on demand. Training quality becomes partly a function of which difficulties the simulator chooses to create.
L0694	R135__NON_OBVIOUS_INSIGHTS__ITEM_03__L13510	NON_OBVIOUS_INSIGHTS	item_03	135	6/28/2026, 5:51:21 AM	ai-prompting-and-description.md:L13510	12	77	Controllability may matter more than realism.	Controllability may matter more than realism. A perfectly realistic simulator that reproduces only common cases teaches little about rare but consequential failures. A strategically imperfect simulator may be more useful when it systematically exposes agents to recovery, ambiguity, and exception handling.
L0695	R135__NON_OBVIOUS_INSIGHTS__ITEM_04__L13514	NON_OBVIOUS_INSIGHTS	item_04	135	6/28/2026, 5:51:21 AM	ai-prompting-and-description.md:L13514	18	80	The result implies that agent competence begins before action training.	The result implies that agent competence begins before action training. A model that understands file systems, interfaces, APIs, and state transitions already possesses part of what an agent needs. Policy learning then becomes the narrower problem of selecting actions inside an already structured causal expectation.
L0696	R135__NON_OBVIOUS_INSIGHTS__ITEM_05__L13518	NON_OBVIOUS_INSIGHTS	item_05	135	6/28/2026, 5:51:21 AM	ai-prompting-and-description.md:L13518	21	80	Synthetic environments convert inaccessible experience into programmable experience.	Synthetic environments convert inaccessible experience into programmable experience. Production systems reveal whatever happens to occur. Simulators let researchers control frequency, difficulty, ordering, and recurrence. Agent training therefore moves from passive data collection toward deliberate experience design.
L0697	R135__NON_OBVIOUS_INSIGHTS__ITEM_06__L13522	NON_OBVIOUS_INSIGHTS	item_06	135	6/28/2026, 5:51:21 AM	ai-prompting-and-description.md:L13522	30	91	The fictional-search transfer result suggests that agents may learn operational invariants rather than memorized worlds.	The fictional-search transfer result suggests that agents may learn operational invariants rather than memorized worlds. If training in invented environments improves performance in real ones, the model may be learning procedures such as query reformulation, evidence aggregation, failure recovery, and state tracking rather than specific search-engine outputs.
