line_id	entry_id	section	field	response	response_date	source	kernel_tokens_est	full_tokens_est	kernel	full
L0191	R041__NON_OBVIOUS_INSIGHTS__ITEM_01__L3713	NON_OBVIOUS_INSIGHTS	item_01	41	6/23/2026, 8:52:51 PM	ai-prompting-and-description.md:L3713	20	97	Skill-MAS relocates learning from model parameters into organizational doctrine.	Skill-MAS relocates learning from model parameters into organizational doctrine. The frozen model does not become more capable internally. Instead, a natural-language Meta-Skill accumulates reusable rules for decomposing tasks, assigning roles, and coordinating workflows. The system improves by rewriting its managerial handbook rather than retraining its workforce. `2606.18837v1.pdf`
L0192	R041__NON_OBVIOUS_INSIGHTS__ITEM_02__L3717	NON_OBVIOUS_INSIGHTS	item_02	41	6/23/2026, 8:52:51 PM	ai-prompting-and-description.md:L3717	17	100	The method treats orchestration as a portable intellectual asset.	The method treats orchestration as a portable intellectual asset. Because the Meta-Skill is external to model weights, it can migrate across models and domains. The transfer experiments suggest that at least some principles-verification, evidence weighting, backtracking, role specialization, and replanning-belong to a higher architectural level than any particular LLM or task. `2606.18837v1.pdf`
L0193	R041__NON_OBVIOUS_INSIGHTS__ITEM_03__L3721	NON_OBVIOUS_INSIGHTS	item_03	41	6/23/2026, 8:52:51 PM	ai-prompting-and-description.md:L3721	19	91	Multi-trajectory rollout converts stochasticity into diagnostic evidence.	Multi-trajectory rollout converts stochasticity into diagnostic evidence. Ordinary agent evaluation often treats inconsistent runs as noise. Skill-MAS measures variance itself, interpreting high dispersion as evidence that orchestration rules are ambiguous or underspecified. Unreliability becomes information about where the governing procedure needs revision.
L0194	R041__NON_OBVIOUS_INSIGHTS__ITEM_04__L3725	NON_OBVIOUS_INSIGHTS	item_04	41	6/23/2026, 8:52:51 PM	ai-prompting-and-description.md:L3725	19	92	Selective Reflection creates an adaptive curriculum for the orchestrator.	Selective Reflection creates an adaptive curriculum for the orchestrator. Tasks are prioritized when they are both difficult and volatile, concentrating reflection on cases that reveal systemic weaknesses rather than merely low scores. The system therefore learns not from all experience equally, but from experiences judged most informative about its own uncertainty.
L0195	R041__NON_OBVIOUS_INSIGHTS__ITEM_05__L3729	NON_OBVIOUS_INSIGHTS	item_05	41	6/23/2026, 8:52:51 PM	ai-prompting-and-description.md:L3729	17	99	The evolved skill increasingly resembles an epistemic constitution.	The evolved skill increasingly resembles an epistemic constitution. The page 8 evolution trace moves from evidence weighting and parallel retrieval toward link verification, backtracking, and merge-node re-execution authority. These are not domain answers; they are rules governing what counts as adequate evidence, when conclusions may be revised, and which components may reopen completed work.
L0196	R042__NON_OBVIOUS_INSIGHTS__ITEM_01__L3792	NON_OBVIOUS_INSIGHTS	item_01	42	6/23/2026, 8:55:18 PM	ai-prompting-and-description.md:L3792	33	116	The benchmark reveals that world-model failure is often a failure of epistemic control rather than raw representational capacity.	The benchmark reveals that world-model failure is often a failure of epistemic control rather than raw representational capacity. In many failed runs, passive automata learners can reconstruct the hidden DFA from observations the LLM has already collected. The agent therefore possesses enough external evidence but cannot organize, integrate, or convert it into a consistent hypothesis. The missing capability is disciplined belief management. `2606.16576v1.pdf`
L0197	R042__NON_OBVIOUS_INSIGHTS__ITEM_02__L3796	NON_OBVIOUS_INSIGHTS	item_02	42	6/23/2026, 8:55:18 PM	ai-prompting-and-description.md:L3796	18	102	Reasoning models gain their advantage primarily by learning what to ask.	Reasoning models gain their advantage primarily by learning what to ask. Performance differences appear not only in final inference but in query planning: weaker models fail to gather sufficient information, while stronger models reduce-but do not eliminate-planning failures. This suggests that agentic intelligence depends as much on constructing informative experiments as on interpreting their results.
L0198	R042__NON_OBVIOUS_INSIGHTS__ITEM_03__L3800	NON_OBVIOUS_INSIGHTS	item_03	42	6/23/2026, 8:55:18 PM	ai-prompting-and-description.md:L3800	18	113	Accumulating context does not reliably become accumulating knowledge.	Accumulating context does not reliably become accumulating knowledge. The full interaction history remains available, yet non-informative queries become more frequent as trajectories lengthen. Evidence stored in a context window is therefore not equivalent to a maintained world model. Without an explicit structure for contradictions, uncertainty, and state distinctions, more memory can produce greater confusion rather than greater understanding.
L0199	R042__NON_OBVIOUS_INSIGHTS__ITEM_04__L3804	NON_OBVIOUS_INSIGHTS	item_04	42	6/23/2026, 8:55:18 PM	ai-prompting-and-description.md:L3804	27	108	The classical algorithms expose a difference between fluent reasoning and invariant-preserving reasoning.	The classical algorithms expose a difference between fluent reasoning and invariant-preserving reasoning. L* and TTT maintain formal properties: every hypothesis incorporates prior evidence, counterexamples refine state distinctions, and queries are informative by construction. LLMs can occasionally discover shorter paths, but they lack these guaranteed invariants. Their flexibility creates rare ingenuity and routine regression.
L0200	R042__NON_OBVIOUS_INSIGHTS__ITEM_05__L3808	NON_OBVIOUS_INSIGHTS	item_05	42	6/23/2026, 8:55:18 PM	ai-prompting-and-description.md:L3808	21	97	The experiment operationalizes a Craikian model as a manipulable causal surrogate.	The experiment operationalizes a Craikian model as a manipulable causal surrogate. Success requires constructing an internal automaton whose transitions reproduce the oracle’s observable behavior under every possible string. The agent is not merely predicting the next response; it must infer a compact mechanism that can stand in for the hidden environment across counterfactual inputs.
L0201	R043__NON_OBVIOUS_INSIGHTS__ITEM_01__L3871	NON_OBVIOUS_INSIGHTS	item_01	43	6/23/2026, 9:00:23 PM	ai-prompting-and-description.md:L3871	21	144	Human-on-the-Bridge converts expert judgment into executable institutional policy.	Human-on-the-Bridge converts expert judgment into executable institutional policy. Experts no longer evaluate each case directly; they predefine traps, juror perspectives, audit rules, scoring criteria, and fallback procedures that govern thousands of later interactions. The human role shifts from adjudicating behavior to designing the constitution under which automated adjudication occurs. The architecture diagram on page 12 makes this allocation explicit: human expertise enters upstream, while the harness repeatedly operationalizes it downstream. `2606.16871v1.pdf`
L0202	R043__NON_OBVIOUS_INSIGHTS__ITEM_02__L3875	NON_OBVIOUS_INSIGHTS	item_02	43	6/23/2026, 9:00:23 PM	ai-prompting-and-description.md:L3875	38	120	The framework’s strongest claim is not that small models can judge frontier models, but that judgment can be decomposed into discovery and verification.	The framework’s strongest claim is not that small models can judge frontier models, but that judgment can be decomposed into discovery and verification. A weaker Harness LLM may help provoke suspicious behavior, while deterministic trace rules verify whether a required tool call occurred or an operational claim was false. Evaluative power therefore comes from combining generative adversarial search with non-generative evidence checks, not from evaluator intelligence alone.
L0203	R043__NON_OBVIOUS_INSIGHTS__ITEM_03__L3879	NON_OBVIOUS_INSIGHTS	item_03	43	6/23/2026, 9:00:23 PM	ai-prompting-and-description.md:L3879	23	94	HOB industrializes red-team knowledge by turning incidents into regression infrastructure.	HOB industrializes red-team knowledge by turning incidents into regression infrastructure. A vulnerability discovered once can become a reusable trap applied across models, prompts, domains, and releases. The evaluation asset is no longer the report describing a failure; it is the executable scenario, evidence rule, and scoring policy capable of detecting its recurrence.
L0204	R043__NON_OBVIOUS_INSIGHTS__ITEM_04__L3883	NON_OBVIOUS_INSIGHTS	item_04	43	6/23/2026, 9:00:23 PM	ai-prompting-and-description.md:L3883	21	100	Juror Personas transform evaluation disagreement from noise into system structure.	Juror Personas transform evaluation disagreement from noise into system structure. Safety, task success, manipulation resistance, procedural correctness, and usefulness are treated as distinct perspectives rather than compressed prematurely into one generic score. This exposes conflicts such as an agent being safe but non-resolving, helpful but procedurally invalid, or compliant but manipulable.
L0205	R043__NON_OBVIOUS_INSIGHTS__ITEM_05__L3887	NON_OBVIOUS_INSIGHTS	item_05	43	6/23/2026, 9:00:23 PM	ai-prompting-and-description.md:L3887	22	108	The real object being evaluated is the sociotechnical stack, not the foundation model.	The real object being evaluated is the sociotechnical stack, not the foundation model. The experiments involve agents with tools, grounding layers, domain skills, policies, provider safeguards, and runtime behavior. Phantom tool claims and skipped compliance calls arise from interactions among these components. HOB therefore implicitly rejects model-level safety claims that are detached from the deployed harness and workflow.
L0206	R044__NON_OBVIOUS_INSIGHTS__ITEM_01__L3950	NON_OBVIOUS_INSIGHTS	item_01	44	6/23/2026, 9:01:57 PM	ai-prompting-and-description.md:L3950	33	102	The OpenClaw incident suggests that agent security failures can arise from the system’s purpose rather than an implementation bug.	The OpenClaw incident suggests that agent security failures can arise from the system’s purpose rather than an implementation bug. If an agent is designed to interpret external content as instructions and act across connected systems, then separating “data” from “commands” becomes structurally difficult. Some vulnerabilities cannot be patched without reducing the autonomy that makes the product valuable.
L0207	R044__NON_OBVIOUS_INSIGHTS__ITEM_02__L3954	NON_OBVIOUS_INSIGHTS	item_02	44	6/23/2026, 9:01:57 PM	ai-prompting-and-description.md:L3954	24	106	The plague analogy points toward institutional selection, not merely technological disruption.	The plague analogy points toward institutional selection, not merely technological disruption. Historical pandemics did not simply kill workers; they altered bargaining power, organizational forms, settlement patterns, and economic institutions. Applied to AI, the relevant prediction is that firms will not merely automate existing jobs. They will reorganize around new distributions of authority, verification, and risk.
L0208	R044__NON_OBVIOUS_INSIGHTS__ITEM_03__L3958	NON_OBVIOUS_INSIGHTS	item_03	44	6/23/2026, 9:01:57 PM	ai-prompting-and-description.md:L3958	21	104	AI adoption may be constrained by process incompatibility more than model weakness.	AI adoption may be constrained by process incompatibility more than model weakness. A capable agent inserted into a workflow designed for human judgment inherits permissions, information flows, and assumptions that were safe only because a person occupied the role. The bottleneck becomes redesigning the surrounding institution so machine-speed action does not convert ordinary ambiguity into system-wide failure.
L0209	R044__NON_OBVIOUS_INSIGHTS__ITEM_04__L3962	NON_OBVIOUS_INSIGHTS	item_04	44	6/23/2026, 9:01:57 PM	ai-prompting-and-description.md:L3962	23	105	Agentic systems erase the traditional boundary between cybersecurity and management design.	Agentic systems erase the traditional boundary between cybersecurity and management design. A hidden instruction in a contact or location can become executable because the agent participates in communication, memory, and action simultaneously. Security therefore depends on who may delegate, which inputs may influence decisions, what actions require confirmation, and how authority is segmented across the organization.
L0210	R044__NON_OBVIOUS_INSIGHTS__ITEM_05__L3966	NON_OBVIOUS_INSIGHTS	item_05	44	6/23/2026, 9:01:57 PM	ai-prompting-and-description.md:L3966	25	100	The most expensive part of enterprise AI may be rebuilding work so that errors remain containable.	The most expensive part of enterprise AI may be rebuilding work so that errors remain containable. Companies may save labor through automation while incurring large costs in access control, process decomposition, monitoring, rollback, audit, and human escalation. The economic question is not whether agents perform tasks cheaply, but whether the organization can safely absorb their failure modes.
L0211	R045__NON_OBVIOUS_INSIGHTS__ITEM_01__L4029	NON_OBVIOUS_INSIGHTS	item_01	45	6/23/2026, 9:03:03 PM	ai-prompting-and-description.md:L4029	26	101	The “implicit organization” is not merely hidden knowledge; it is a distributed error-correction system.	The “implicit organization” is not merely hidden knowledge; it is a distributed error-correction system. Informal messages, professional instincts, reputational concern, and hesitation continuously repair the incompleteness of formal workflows. When agents replace workers, firms do not simply lose undocumented information. They remove the mechanisms that noticed when the documented process was wrong.
L0212	R045__NON_OBVIOUS_INSIGHTS__ITEM_02__L4033	NON_OBVIOUS_INSIGHTS	item_02	45	6/23/2026, 9:03:03 PM	ai-prompting-and-description.md:L4033	26	111	Agent deployment converts tacit judgment from an abundant byproduct of work into a scarce capital asset.	Agent deployment converts tacit judgment from an abundant byproduct of work into a scarce capital asset. Human organizations historically produced judgment incidentally through repeated practice, observation, social feedback, and accountability. Once routine work is automated, firms must deliberately finance simulations, red-team rotations, shadowing, and supervised exceptions to reproduce what ordinary employment once generated for free.
L0213	R045__NON_OBVIOUS_INSIGHTS__ITEM_03__L4037	NON_OBVIOUS_INSIGHTS	item_03	45	6/23/2026, 9:03:03 PM	ai-prompting-and-description.md:L4037	15	98	Escalation systems are also organizational learning systems.	Escalation systems are also organizational learning systems. Routing uncertain cases to humans is usually framed as a safety mechanism. But the deeper value is epistemic: edge cases reveal where formal policy fails to encode actual organizational purpose. The escalation queue becomes the interface through which tacit rules are discovered, contested, and translated into durable procedure.
L0214	R045__NON_OBVIOUS_INSIGHTS__ITEM_04__L4041	NON_OBVIOUS_INSIGHTS	item_04	45	6/23/2026, 9:03:03 PM	ai-prompting-and-description.md:L4041	19	97	Multi-agent failure can arise without any component behaving incorrectly.	Multi-agent failure can arise without any component behaving incorrectly. Each agent may satisfy its local objective while the organization collectively loses customers, accumulates risk, or degrades trust. This is a coordination failure caused by objective fragmentation: system-level harm emerges from locally compliant actions whose combined consequence belongs to no agent’s mandate.
L0215	R045__NON_OBVIOUS_INSIGHTS__ITEM_05__L4045	NON_OBVIOUS_INSIGHTS	item_05	45	6/23/2026, 9:03:03 PM	ai-prompting-and-description.md:L4045	22	103	The article implicitly defines an organization as a world model maintained by people.	The article implicitly defines an organization as a world model maintained by people. Employees do more than execute tasks. They hold expectations about customers, exceptions, reputational consequences, historical failures, and what normally happens next. Agentic transformation therefore requires reconstructing the firm’s latent causal model, not merely translating its procedure manual into prompts and tools.
L0216	R046__NON_OBVIOUS_INSIGHTS__ITEM_01__L4108	NON_OBVIOUS_INSIGHTS	item_01	46	6/23/2026, 9:06:03 PM	ai-prompting-and-description.md:L4108	24	106	The government’s directive governs global AI access by controlling a single domestic chokepoint.	The government’s directive governs global AI access by controlling a single domestic chokepoint. Rather than regulating every foreign user directly, the United States can compel a U.S. model provider to redesign access worldwide. Frontier-model policy therefore operates less like ordinary export licensing and more like infrastructure governance: control the provider, and the provider becomes the enforcement mechanism.
L0217	R046__NON_OBVIOUS_INSIGHTS__ITEM_02__L4112	NON_OBVIOUS_INSIGHTS	item_02	46	6/23/2026, 9:06:03 PM	ai-prompting-and-description.md:L4112	19	117	Anthropic’s worldwide shutdown reveals the power of regulatory ambiguity.	Anthropic’s worldwide shutdown reveals the power of regulatory ambiguity. The directive reportedly targeted access by “any foreign national,” but Anthropic disabled the models for all customers to ensure compliance. When legal boundaries are unclear and penalties potentially severe, firms rationally over-comply. The practical reach of government action can therefore exceed the formal scope of the order without any agency explicitly demanding the broader result.
L0218	R046__NON_OBVIOUS_INSIGHTS__ITEM_03__L4116	NON_OBVIOUS_INSIGHTS	item_03	46	6/23/2026, 9:06:03 PM	ai-prompting-and-description.md:L4116	18	102	The lawsuit turns model access into a dependency and continuity claim.	The lawsuit turns model access into a dependency and continuity claim. Legion does not merely argue that it preferred Anthropic’s models. It describes loss of access as existential because its product, development team, and competitive position depend on them. This shows how quickly a vendor API can become critical business infrastructure even when customers possess no durable right to continued access.
L0219	R046__NON_OBVIOUS_INSIGHTS__ITEM_04__L4120	NON_OBVIOUS_INSIGHTS	item_04	46	6/23/2026, 9:06:03 PM	ai-prompting-and-description.md:L4120	24	103	Nationality-based restrictions collide with the distributed structure of modern software firms.	Nationality-based restrictions collide with the distributed structure of modern software firms. A U.S. company can employ foreign nationals abroad, foreign nationals inside the United States, and multinational teams sharing the same development environment. Restricting users by nationality rather than location, organization, clearance, or conduct turns ordinary workforce composition into a compliance problem.
L0220	R046__NON_OBVIOUS_INSIGHTS__ITEM_05__L4124	NON_OBVIOUS_INSIGHTS	item_05	46	6/23/2026, 9:06:03 PM	ai-prompting-and-description.md:L4124	14	108	The dispute reveals a three-sided sovereignty conflict.	The dispute reveals a three-sided sovereignty conflict. The government claims authority over national-security access; Anthropic claims authority to impose safety limits on military use; customers claim reliance interests in tools essential to their businesses. The central struggle is not simply public versus private power, but which institution may define acceptable use of a strategically important general-purpose capability.
L0221	R047__NON_OBVIOUS_INSIGHTS__ITEM_01__L4187	NON_OBVIOUS_INSIGHTS	item_01	47	6/24/2026, 6:03:55 AM	ai-prompting-and-description.md:L4187	29	99	The real breakthrough was not generative AI but converting institutional memory into a searchable decision system.	The real breakthrough was not generative AI but converting institutional memory into a searchable decision system. Three years of resolved payment records supplied the examples, while Treasury staff supplied the investigative logic. The models became useful only after the organization externalized how experienced employees identify vendors, interpret weak signals, and route ambiguous payments.
L0222	R047__NON_OBVIOUS_INSIGHTS__ITEM_02__L4191	NON_OBVIOUS_INSIGHTS	item_02	47	6/24/2026, 6:03:55 AM	ai-prompting-and-description.md:L4191	16	92	The system separates cheap certainty from expensive ambiguity.	The system separates cheap certainty from expensive ambiguity. Fuzzy matching handles recurring vendors deterministically, while web search and language-model synthesis are reserved for difficult cases. This tiered architecture matters more than using the most powerful model everywhere: conventional software resolves the common case, and AI absorbs the long tail.
L0223	R047__NON_OBVIOUS_INSIGHTS__ITEM_03__L4195	NON_OBVIOUS_INSIGHTS	item_03	47	6/24/2026, 6:03:55 AM	ai-prompting-and-description.md:L4195	27	91	The pipeline turns historical administrative work into training capital without formally training a model.	The pipeline turns historical administrative work into training capital without formally training a model. Every previously resolved payment becomes a precedent that improves future routing. The organization captures value from years of human investigation by placing those outcomes inside retrieval and matching infrastructure rather than modifying model weights.
L0224	R047__NON_OBVIOUS_INSIGHTS__ITEM_04__L4199	NON_OBVIOUS_INSIGHTS	item_04	47	6/24/2026, 6:03:55 AM	ai-prompting-and-description.md:L4199	15	90	Confidence sorting changes the economics of human review.	Confidence sorting changes the economics of human review. The spreadsheet does not eliminate Treasury work; it rearranges it. Staff can begin with high-confidence, high-value, or easily verifiable cases instead of investigating every transaction from scratch. The productivity gain comes partly from prioritizing attention, not merely automating conclusions.
L0225	R047__NON_OBVIOUS_INSIGHTS__ITEM_05__L4203	NON_OBVIOUS_INSIGHTS	item_05	47	6/24/2026, 6:03:55 AM	ai-prompting-and-description.md:L4203	25	108	The system’s hardest failure reveals that identity and destination are different inference problems.	The system’s hardest failure reveals that identity and destination are different inference problems. A vendor may be recognized with high confidence while the correct Cornell department remains ambiguous. The first task depends on external identity evidence; the second depends on internal organizational relationships, purpose, and transaction context. Success at entity resolution does not imply success at institutional routing.
L0226	R048__NON_OBVIOUS_INSIGHTS__ITEM_01__L4266	NON_OBVIOUS_INSIGHTS	item_01	48	6/24/2026, 6:07:13 AM	ai-prompting-and-description.md:L4266	27	93	Epic is trying to turn the game engine from a production tool into a social and economic operating system.	Epic is trying to turn the game engine from a production tool into a social and economic operating system. Portable identities, items, currencies, and communication would make Unreal Engine govern what persists between games, not merely how individual games are built. The strategic prize is the layer above titles where player relationships and accumulated value reside.
L0227	R048__NON_OBVIOUS_INSIGHTS__ITEM_02__L4270	NON_OBVIOUS_INSIGHTS	item_02	48	6/24/2026, 6:07:13 AM	ai-prompting-and-description.md:L4270	31	99	Sweeney correctly identifies multiplayer adoption as a coordination problem rather than an individual purchasing decision.	Sweeney correctly identifies multiplayer adoption as a coordination problem rather than an individual purchasing decision. A player may like a new game but still avoid it because participation depends on friends buying, downloading, learning, and continuing to play simultaneously. The relevant customer is often the group, and the weakest member’s willingness can determine whether anyone moves.
L0228	R048__NON_OBVIOUS_INSIGHTS__ITEM_03__L4274	NON_OBVIOUS_INSIGHTS	item_03	48	6/24/2026, 6:07:13 AM	ai-prompting-and-description.md:L4274	16	94	Portable assets convert sunk costs into migration instruments.	Portable assets convert sunk costs into migration instruments. Cosmetics and status normally keep players inside one game because leaving means abandoning accumulated value. Epic proposes making those investments portable, but only within an Unreal-centered ecosystem. Portability reduces lock-in at the game level while potentially increasing it at the engine-platform level.
L0229	R048__NON_OBVIOUS_INSIGHTS__ITEM_04__L4278	NON_OBVIOUS_INSIGHTS	item_04	48	6/24/2026, 6:07:13 AM	ai-prompting-and-description.md:L4278	26	110	Cross-game communication solves social separation less than it creates an embedded acquisition channel.	Cross-game communication solves social separation less than it creates an embedded acquisition channel. Friends already communicate through platform parties and Discord. Epic’s distinctive advantage would be connecting conversation directly to game discovery, invitations, ownership, identities, and portable rewards. The feature’s commercial value lies in shortening the path from “my friend is playing something else” to “join and spend.”
