line_id	entry_id	section	field	response	response_date	source	kernel_tokens_est	full_tokens_est	kernel	full
L0395	R082__NON_OBVIOUS_INSIGHTS__ITEM_05__L7391	NON_OBVIOUS_INSIGHTS	item_05	82	6/25/2026, 4:11:57 PM	ai-prompting-and-description.md:L7391	34	100	The refusal of universal basic income reveals that employment is being treated as a moral institution, not merely an income mechanism.	The refusal of universal basic income reveals that employment is being treated as a moral institution, not merely an income mechanism. Raise Us emphasizes meaning, identity, and social participation through work. Yet this position also protects a system in which access to income, health care, status, and social legitimacy remains contingent on finding an employer willing to purchase one’s labor.
L0396	R083__NON_OBVIOUS_INSIGHTS__ITEM_01__L7458	NON_OBVIOUS_INSIGHTS	item_01	83	6/25/2026, 4:13:12 PM	ai-prompting-and-description.md:L7458	18	85	“AI native” is being constructed as a new form of executive legitimacy.	“AI native” is being constructed as a new form of executive legitimacy. Corporate authority traditionally flowed from tenure, institutional memory, and accumulated responsibility. Here, proximity to a rapidly changing tool ecosystem becomes sufficient grounds for entering the C-suite. Fluency displaces seniority as the scarce credential.
L0397	R083__NON_OBVIOUS_INSIGHTS__ITEM_02__L7462	NON_OBVIOUS_INSIGHTS	item_02	83	6/25/2026, 4:13:12 PM	ai-prompting-and-description.md:L7462	21	87	The appointment turns generational difference into organizational infrastructure.	The appointment turns generational difference into organizational infrastructure. Lakhani is not merely hired to operate models. He is expected to alter product design, recruiting, learning practices, and marketing culture. The company is using one young executive as a translation layer between older leadership and an imagined AI-shaped future.
L0398	R083__NON_OBVIOUS_INSIGHTS__ITEM_03__L7466	NON_OBVIOUS_INSIGHTS	item_03	83	6/25/2026, 4:13:12 PM	ai-prompting-and-description.md:L7466	23	90	The proposed application model transfers judgment from product designers to the AI system.	The proposed application model transfers judgment from product designers to the AI system. The strategy of giving AI broad data access and letting it determine what is valuable replaces deterministic analytics with probabilistic curation. The product no longer simply answers questions selected by users; it begins deciding which questions deserve attention.
L0399	R083__NON_OBVIOUS_INSIGHTS__ITEM_04__L7470	NON_OBVIOUS_INSIGHTS	item_04	83	6/25/2026, 4:13:12 PM	ai-prompting-and-description.md:L7470	15	96	AI competence is being inferred from habits of delegation.	AI competence is being inferred from habits of delegation. Generating a podcast to learn model evaluation is treated as evidence of a new cognitive style: knowledge does not need to be read, memorized, or assembled in established formats if a model can repackage it immediately. The executive advantage lies partly in treating every information environment as transformable on demand.
L0400	R083__NON_OBVIOUS_INSIGHTS__ITEM_05__L7474	NON_OBVIOUS_INSIGHTS	item_05	83	6/25/2026, 4:13:12 PM	ai-prompting-and-description.md:L7474	25	104	The chief AI officer role may function as institutional permission to violate inherited procedure.	The chief AI officer role may function as institutional permission to violate inherited procedure. Youth gives Lakhani license to suggest practices older executives might reject from peers: meme-based marketing, AI-mediated interviews, model-directed analytics, and unconventional learning. His age is valuable not only because he knows new tools, but because he is symbolically exempt from defending old workflows.
L0401	R084__NON_OBVIOUS_INSIGHTS__ITEM_01__L7541	NON_OBVIOUS_INSIGHTS	item_01	84	6/25/2026, 4:15:02 PM	ai-prompting-and-description.md:L7541	21	100	AI coding creates a throughput imbalance rather than a universal productivity gain.	AI coding creates a throughput imbalance rather than a universal productivity gain. Developers produce changes faster, but infrastructure, security, compliance, and operations teams must still verify, deploy, monitor, and repair them. The organization becomes “faster” only at the point where code enters the pipeline; downstream labor absorbs the acceleration as review debt and operational risk.
L0402	R084__NON_OBVIOUS_INSIGHTS__ITEM_02__L7545	NON_OBVIOUS_INSIGHTS	item_02	84	6/25/2026, 4:15:02 PM	ai-prompting-and-description.md:L7545	19	108	The real unit of AI-generated infrastructure is not code but blast radius.	The real unit of AI-generated infrastructure is not code but blast radius. A defective application function may inconvenience one feature. A defective infrastructure declaration can expose data, delete resources, weaken identity controls, violate compliance requirements, or destabilize every service depending on the environment. Similar-looking code therefore carries radically unequal consequences depending on where it executes.
L0403	R084__NON_OBVIOUS_INSIGHTS__ITEM_03__L7549	NON_OBVIOUS_INSIGHTS	item_03	84	6/25/2026, 4:15:02 PM	ai-prompting-and-description.md:L7549	18	102	Confidence is being inferred from the absence of visible catastrophe.	Confidence is being inferred from the absence of visible catastrophe. Organizations without policies or automated controls often report strong confidence because many failures remain latent as drift, excessive permissions, hidden costs, brittle dependencies, or configurations that have not yet encountered an adversarial condition. “Nothing terrible happened” becomes mistaken for evidence of governance.
L0404	R084__NON_OBVIOUS_INSIGHTS__ITEM_04__L7553	NON_OBVIOUS_INSIGHTS	item_04	84	6/25/2026, 4:15:02 PM	ai-prompting-and-description.md:L7553	27	89	Pioneer organizations succeed not because they trust AI less but because they trust individual outputs less.	Pioneer organizations succeed not because they trust AI less but because they trust individual outputs less. They may generate infrastructure aggressively, yet treat every change as untrusted input moving through policy checks, tests, plans, approvals, and rollback mechanisms. Their advantage is architectural skepticism rather than superior prompting.
L0405	R084__NON_OBVIOUS_INSIGHTS__ITEM_05__L7557	NON_OBVIOUS_INSIGHTS	item_05	84	6/25/2026, 4:15:02 PM	ai-prompting-and-description.md:L7557	16	96	Agentic infrastructure eliminates review as a discrete event.	Agentic infrastructure eliminates review as a discrete event. When an agent continuously modifies cloud resources, permissions, networks, or deployment pipelines, governance cannot depend on a human examining a final pull request. Policy must become executable and continuous: permissions, constraints, validation, observability, and automatic containment must accompany every action.
L0406	R085__NON_OBVIOUS_INSIGHTS__ITEM_01__L7624	NON_OBVIOUS_INSIGHTS	item_01	85	6/25/2026, 4:17:09 PM	ai-prompting-and-description.md:L7624	33	117	The real breakthrough is not code generation but the construction of an environment that prevents the model from lying to itself.	The real breakthrough is not code generation but the construction of an environment that prevents the model from lying to itself. The early failures came from hallucinated APIs, assumed success, stale logs, and incomplete testing. Reliability emerged only after the author surrounded the model with documentation, constrained interfaces, live test systems, process telemetry, and an independent QA stage. The harness—not the model—is the durable technical achievement.
L0407	R085__NON_OBVIOUS_INSIGHTS__ITEM_02__L7628	NON_OBVIOUS_INSIGHTS	item_02	85	6/25/2026, 4:17:09 PM	ai-prompting-and-description.md:L7628	25	102	“Disposable tooling” changes the economics of offensive software from preservation to regeneration.	“Disposable tooling” changes the economics of offensive software from preservation to regeneration. Traditional implants accumulate features, maintenance, signatures, and institutional history. Prompt-generated agents can be treated as temporary artifacts produced for one environment and discarded afterward. The valuable object becomes the production system capable of repeatedly generating replacements.
L0408	R085__NON_OBVIOUS_INSIGHTS__ITEM_03__L7632	NON_OBVIOUS_INSIGHTS	item_03	85	6/25/2026, 4:17:09 PM	ai-prompting-and-description.md:L7632	19	96	The clean-context QA agent functions as an artificial separation of powers.	The clean-context QA agent functions as an artificial separation of powers. The primary model is invested in its own implementation and carries a context full of apparent progress. A second model with no development history is less susceptible to accepting claims that merely sound completed. The architecture operationalizes epistemic distrust by separating builder from verifier.
L0409	R085__NON_OBVIOUS_INSIGHTS__ITEM_04__L7636	NON_OBVIOUS_INSIGHTS	item_04	85	6/25/2026, 4:17:09 PM	ai-prompting-and-description.md:L7636	20	110	The model’s most dangerous defect is premature closure rather than bad syntax.	The model’s most dangerous defect is premature closure rather than bad syntax. Generated code often compiled and appeared professionally organized. Failure arose because the system converted plausibility into proof: a process started, therefore it was stable; several commands worked, therefore all requirements were met; a patch fixed a container, therefore the source was repaired. The harness had to make completion externally decidable.
L0410	R085__NON_OBVIOUS_INSIGHTS__ITEM_05__L7640	NON_OBVIOUS_INSIGHTS	item_05	85	6/25/2026, 4:17:09 PM	ai-prompting-and-description.md:L7640	28	89	Generative offensive tooling attacks the economics of detection more than the sophistication of exploitation.	Generative offensive tooling attacks the economics of detection more than the sophistication of exploitation. Basic agents become consequential when they can be produced in many languages, structures, and implementations at low cost. Defenders can no longer assume that identifying one binary family meaningfully reduces the adversary’s future capacity.
L0411	R086__NON_OBVIOUS_INSIGHTS__ITEM_01__L7707	NON_OBVIOUS_INSIGHTS	item_01	86	6/25/2026, 4:19:27 PM	ai-prompting-and-description.md:L7707	27	105	Americans are not primarily afraid of AI; they are afraid of falling through institutions that already fail.	Americans are not primarily afraid of AI; they are afraid of falling through institutions that already fail. The technology acts as a threat multiplier because employment anchors income, health insurance, housing stability, child care, retirement contributions, and professional identity. AI anxiety is therefore a rational response to the consequences of job loss rather than a misunderstanding of technical progress.
L0412	R086__NON_OBVIOUS_INSIGHTS__ITEM_02__L7711	NON_OBVIOUS_INSIGHTS	item_02	86	6/25/2026, 4:19:27 PM	ai-prompting-and-description.md:L7711	25	114	The same technology can appear emancipatory or predatory depending on a worker’s starting position.	The same technology can appear emancipatory or predatory depending on a worker’s starting position. For someone excluded from formal employment, AI may provide capabilities previously locked behind education, capital, or organizational access. For someone whose livelihood rests on a specialized career, it may devalue years of accumulated status. Public opinion reflects position within the labor system more than a universal attitude toward innovation.
L0413	R086__NON_OBVIOUS_INSIGHTS__ITEM_03__L7715	NON_OBVIOUS_INSIGHTS	item_03	86	6/25/2026, 4:19:27 PM	ai-prompting-and-description.md:L7715	14	90	Social insurance functions as innovation infrastructure.	Social insurance functions as innovation infrastructure. Unemployment benefits and universal health care do not merely relieve suffering after disruption. They give people the practical freedom to tolerate experimentation, change jobs, retrain, start companies, or accept technological risk. A safety net can make a society more—not less—capable of adapting.
L0414	R086__NON_OBVIOUS_INSIGHTS__ITEM_04__L7719	NON_OBVIOUS_INSIGHTS	item_04	86	6/25/2026, 4:19:27 PM	ai-prompting-and-description.md:L7719	17	77	American AI pessimism exposes the hidden design of employer power.	American AI pessimism exposes the hidden design of employer power. When health care and basic security depend on employment, employers possess leverage extending far beyond wages. AI threatens to strengthen that leverage by making replacement more credible while workers remain unable to risk unemployment.
L0415	R086__NON_OBVIOUS_INSIGHTS__ITEM_05__L7723	NON_OBVIOUS_INSIGHTS	item_05	86	6/25/2026, 4:19:27 PM	ai-prompting-and-description.md:L7723	15	91	The article recasts “AI communication” as a political decoy.	The article recasts “AI communication” as a political decoy. Calls for better messaging assume opposition arises from ignorance. But no branding campaign can persuade workers that displacement is harmless when a lost job may trigger medical, financial, and familial crisis. The public does not need a more inspiring story; it needs different material consequences.
L0416	R087__NON_OBVIOUS_INSIGHTS__ITEM_01__L7788	NON_OBVIOUS_INSIGHTS	item_01	87	6/25/2026, 4:27:43 PM	ai-prompting-and-description.md:L7788	35	102	The dispute shows that frontier-model governance is being negotiated through personal access rather than settled institutional procedure.	The dispute shows that frontier-model governance is being negotiated through personal access rather than settled institutional procedure. Whether Anthropic can restore a major model appears to depend partly on which executive joins the call, how concerns are acknowledged, and whether the parties find one another tolerable. A question about national security is being mediated through executive chemistry.
L0417	R087__NON_OBVIOUS_INSIGHTS__ITEM_02__L7792	NON_OBVIOUS_INSIGHTS	item_02	87	6/25/2026, 4:27:43 PM	ai-prompting-and-description.md:L7792	29	94	Replacing Amodei with Brown is not merely a communications adjustment; it redistributes authority inside Anthropic.	Replacing Amodei with Brown is not merely a communications adjustment; it redistributes authority inside Anthropic. The person who can maintain political access becomes functionally important to product deployment, regardless of who holds the chief executive title. In heavily regulated technology, diplomatic competence can become as consequential as technical leadership.
L0418	R087__NON_OBVIOUS_INSIGHTS__ITEM_03__L7796	NON_OBVIOUS_INSIGHTS	item_03	87	6/25/2026, 4:27:43 PM	ai-prompting-and-description.md:L7796	21	98	The White House’s demand for proof may be impossible to satisfy in absolute terms.	The White House’s demand for proof may be impossible to satisfy in absolute terms. If guardrails are bypassable in principle, Anthropic cannot prove that no sufficiently skilled user or future model will defeat them. The negotiation must therefore move from “perfectly safe” toward an unstated acceptable-risk threshold—yet the article suggests that threshold has not been formally defined.
L0419	R087__NON_OBVIOUS_INSIGHTS__ITEM_04__L7800	NON_OBVIOUS_INSIGHTS	item_04	87	6/25/2026, 4:27:43 PM	ai-prompting-and-description.md:L7800	17	86	Export controls are being used here as domestic product governance.	Export controls are being used here as domestic product governance. Although such controls ordinarily regulate cross-border transfer, the reported action effectively took a model offline and made its public redeployment conditional on satisfying security concerns. Trade authority becomes an indirect mechanism for controlling model release.
L0420	R087__NON_OBVIOUS_INSIGHTS__ITEM_05__L7804	NON_OBVIOUS_INSIGHTS	item_05	87	6/25/2026, 4:27:43 PM	ai-prompting-and-description.md:L7804	11	91	The label “weirdo” performs political work.	The label “weirdo” performs political work. It converts a substantive disagreement over evidence, jailbreaks, and state authority into a personality defect. Once one party is framed as socially abnormal or impossible to engage, excluding that person can appear like administrative common sense rather than a shift in whose objections receive institutional weight.
L0421	R088__NON_OBVIOUS_INSIGHTS__ITEM_01__L7871	NON_OBVIOUS_INSIGHTS	item_01	88	6/25/2026, 5:53:49 PM	ai-prompting-and-description.md:L7871	31	95	Patronus is not merely testing agents; it is building artificial institutions in which agent behavior becomes measurable.	Patronus is not merely testing agents; it is building artificial institutions in which agent behavior becomes measurable. A replica website or financial system must encode permissions, workflows, hidden state, success conditions, and consequences. The company’s real product is therefore a formalized world containing enough structure to judge whether an agent acted correctly.
L0422	R088__NON_OBVIOUS_INSIGHTS__ITEM_02__L7875	NON_OBVIOUS_INSIGHTS	item_02	88	6/25/2026, 5:53:49 PM	ai-prompting-and-description.md:L7875	22	89	Agent evaluation is moving from static examinations to prolonged behavioral observation.	Agent evaluation is moving from static examinations to prolonged behavioral observation. Benchmarks ask whether a model can produce the right answer once. Digital worlds ask whether it can preserve goals, recover from errors, resist shortcuts, and remain reliable across hours or weeks of interaction. Capability becomes a trajectory rather than a score.
L0423	R088__NON_OBVIOUS_INSIGHTS__ITEM_03__L7879	NON_OBVIOUS_INSIGHTS	item_03	88	6/25/2026, 5:53:49 PM	ai-prompting-and-description.md:L7879	23	89	The tendency of agents to “hack” evaluations reveals a fundamental specification problem.	The tendency of agents to “hack” evaluations reveals a fundamental specification problem. An agent may maximize the measurable reward while violating the intended task. Patronus is valuable because it searches for divergences between formal success and legitimate completion—the same gap that appears whenever institutions turn complex work into metrics.
L0424	R088__NON_OBVIOUS_INSIGHTS__ITEM_04__L7883	NON_OBVIOUS_INSIGHTS	item_04	88	6/25/2026, 5:53:49 PM	ai-prompting-and-description.md:L7883	15	79	Simulation enables companies to industrialize rare failure.	Simulation enables companies to industrialize rare failure. Real organizations cannot repeatedly trigger fraud, database corruption, market shocks, permission mistakes, or prolonged workflow breakdowns merely to see what an agent does. Synthetic worlds make dangerous edge cases reproducible, cheap, and resettable.
L0425	R088__NON_OBVIOUS_INSIGHTS__ITEM_05__L7887	NON_OBVIOUS_INSIGHTS	item_05	88	6/25/2026, 5:53:49 PM	ai-prompting-and-description.md:L7887	25	78	Patronus is creating an evaluation layer that may become more powerful than individual benchmarks.	Patronus is creating an evaluation layer that may become more powerful than individual benchmarks. Whoever designs the environment determines what counts as a valid action, an error, a shortcut, a successful outcome, and an acceptable risk. The world designer quietly becomes the legislator of agent behavior.
L0426	R089__NON_OBVIOUS_INSIGHTS__ITEM_01__L7950	NON_OBVIOUS_INSIGHTS	item_01	89	6/26/2026, 2:21:36 AM	ai-prompting-and-description.md:L7950	27	98	Codeplain is not eliminating maintenance; it is relocating maintenance into the specification and generator.	Codeplain is not eliminating maintenance; it is relocating maintenance into the specification and generator. The implementation may become disposable, but the system still depends on durable semantics, compiler behavior, dependency resolution, tests, migration rules, and regeneration infrastructure. Technical debt does not vanish. It moves upward into the artifacts that produce the code.
L0427	R089__NON_OBVIOUS_INSIGHTS__ITEM_02__L7954	NON_OBVIOUS_INSIGHTS	item_02	89	6/26/2026, 2:21:36 AM	ai-prompting-and-description.md:L7954	23	95	The deepest inversion is that code stops being the authoritative description of the program.	The deepest inversion is that code stops being the authoritative description of the program. In conventional software, the running implementation is the final truth, however poorly documented. In regenerative software, code becomes a compiled projection of a more durable theory: entities, operations, conditions, invariants, and intended outcomes expressed in the specification.
L0428	R089__NON_OBVIOUS_INSIGHTS__ITEM_03__L7958	NON_OBVIOUS_INSIGHTS	item_03	89	6/26/2026, 2:21:36 AM	ai-prompting-and-description.md:L7958	22	93	Regeneration converts software development from textual editing into model preservation.	Regeneration converts software development from textual editing into model preservation. A developer no longer asks, “Which line should change?” but “Which rule of the system is wrong or incomplete?” This can produce cleaner reasoning because modifications must be expressed at the level of intended behavior rather than patched into accidental implementation structure.
L0429	R089__NON_OBVIOUS_INSIGHTS__ITEM_04__L7962	NON_OBVIOUS_INSIGHTS	item_04	89	6/26/2026, 2:21:36 AM	ai-prompting-and-description.md:L7962	21	95	“The conversation is the commit” turns design history into executable provenance.	“The conversation is the commit” turns design history into executable provenance. The valuable record is no longer merely a sequence of code diffs but the chain of requests, assumptions, decisions, rejected alternatives, and validations that caused the implementation to exist. Version control shifts from tracking textual mutation toward tracking changes in institutional intent.
L0430	R089__NON_OBVIOUS_INSIGHTS__ITEM_05__L7966	NON_OBVIOUS_INSIGHTS	item_05	89	6/26/2026, 2:21:36 AM	ai-prompting-and-description.md:L7966	24	95	The approach introduces a new compiler boundary between expensive judgment and cheap execution.	The approach introduces a new compiler boundary between expensive judgment and cheap execution. Frontier models research the problem and draft the specification; cheaper deterministic or specialized systems generate the implementation. This resembles traditional compilation, but the source language is now partially semantic and conversational rather than primarily syntactic.
L0431	R090__NON_OBVIOUS_INSIGHTS__ITEM_01__L8043	NON_OBVIOUS_INSIGHTS	item_01	90	6/27/2026, 9:44:23 AM	ai-prompting-and-description.md:L8043	19	119	Loop engineering moves the human from operator to constitutional designer.	Loop engineering moves the human from operator to constitutional designer. Prompt engineering governs individual utterances; context engineering governs what the model can see; harness engineering governs what tools it can use. Loop engineering governs the recurring institution around the agent: how work is discovered, delegated, judged, remembered, and resumed. The practitioner stops issuing commands and begins writing the rules under which commands will be generated.
L0432	R090__NON_OBVIOUS_INSIGHTS__ITEM_02__L8047	NON_OBVIOUS_INSIGHTS	item_02	90	6/27/2026, 9:44:23 AM	ai-prompting-and-description.md:L8047	17	88	The decisive automation is not task execution but task continuation.	The decisive automation is not task execution but task continuation. An agent that completes one assignment still depends on a human to notice completion, choose what comes next, and restart activity. Scheduling, persistence, and discovery remove that waiting state. The loop becomes autonomous precisely when it can manufacture its next reason to act.
L0433	R090__NON_OBVIOUS_INSIGHTS__ITEM_03__L8051	NON_OBVIOUS_INSIGHTS	item_03	90	6/27/2026, 9:44:23 AM	ai-prompting-and-description.md:L8051	23	105	Generator–evaluator separation is an organizational principle disguised as an agent pattern.	Generator–evaluator separation is an organizational principle disguised as an agent pattern. The claim that models praise their own work reproduces a familiar institutional problem: creators are poor auditors of the systems they are invested in completing. Reliability comes not from making one agent more reflective, but from assigning criticism to a separate role with different instructions, evidence, and incentives.
L0434	R090__NON_OBVIOUS_INSIGHTS__ITEM_04__L8055	NON_OBVIOUS_INSIGHTS	item_04	90	6/27/2026, 9:44:23 AM	ai-prompting-and-description.md:L8055	20	92	Loop engineering makes judgment—not generation—the scarce production resource.	Loop engineering makes judgment—not generation—the scarce production resource. Once agents can generate patches, reports, tests, and revisions continuously, output abundance ceases to be evidence of progress. The bottleneck becomes deciding what deserves to exist, which failures matter, when work is finished, and whether the system is pursuing the right objective.
L0435	R090__NON_OBVIOUS_INSIGHTS__ITEM_05__L8059	NON_OBVIOUS_INSIGHTS	item_05	90	6/27/2026, 9:44:23 AM	ai-prompting-and-description.md:L8059	25	96	The term’s simultaneous emergence suggests a capability threshold rather than an isolated invention.	The term’s simultaneous emergence suggests a capability threshold rather than an isolated invention. Steinberger, Cherny, and Osmani appear to have named the same shift because agents, schedulers, costs, and harnesses became jointly sufficient. The concept did not create the practice; it became speakable once previously incomplete components formed a repeatable operating system.
