line_id	section	field	source	visual_seed
L1658	TENSIONS_CONTRADICTIONS	item_02	ai-prompting-and-description.md:L14745	Visualize as one stark diagram: Meaning is declared public, but intention still matters centrally to distinguishing wink, parody, rehearsal, and fraud.
L1659	TENSIONS_CONTRADICTIONS	item_03	ai-prompting-and-description.md:L14749	Visualize as one stark diagram: The ethnographer is warned against pretending to become native, yet must formulate accounts in terms of actors’ own interpretations.
L1660	TENSIONS_CONTRADICTIONS	item_04	ai-prompting-and-description.md:L14753	Visualize as one stark diagram: Geertz emphasizes the fashioned, fictional character of ethnographic writing but defends its claim to knowledge through interpretive power.
L1661	TENSIONS_CONTRADICTIONS	item_05	ai-prompting-and-description.md:L14757	Visualize as one stark diagram: The article criticizes formalism and the dream of an “ethnographic algorithm,” yet it offers reusable conceptual structures-thin versus thick description, inscription, public meaning, symbolic action-that can themselves harden into a new formula.
L1662	TENSIONS_CONTRADICTIONS	item_06	ai-prompting-and-description.md:L14761	Visualize as one stark diagram: Interpretation must stay close to specific events, but it is also expected to speak to large questions.
L1663	TENSIONS_CONTRADICTIONS	item_07	ai-prompting-and-description.md:L14765	Visualize as one stark diagram: Theory is said to generalize within cases rather than across them, yet concepts such as culture, symbol, discourse, and meaning are repeatedly moved between very different cases.
L1664	TENSIONS_CONTRADICTIONS	item_08	ai-prompting-and-description.md:L14769	Visualize as one stark diagram: Geertz treats actor-oriented interpretation as essential, but actors themselves disagree, deceive, misunderstand, and inhabit unequal positions.
L1665	TENSIONS_CONTRADICTIONS	item_09	ai-prompting-and-description.md:L14773	Visualize as one stark diagram: The account treats public meaning as accessible through interpretation while also insisting that analysis is intrinsically incomplete.
L1666	TENSIONS_CONTRADICTIONS	item_01	ai-prompting-and-description.md:L14970	Visualize as one stark diagram: A simulator normally supports interventions: an agent takes an action and the environment returns a consequential next state.
L1667	TENSIONS_CONTRADICTIONS	item_02	ai-prompting-and-description.md:L14974	Visualize as one stark diagram: Visual plausibility is not causal fidelity.
L1668	TENSIONS_CONTRADICTIONS	item_03	ai-prompting-and-description.md:L14978	Visualize as one stark diagram: The report cites object permanence and state persistence as emergent capabilities while acknowledging spontaneous object appearances, incorrect eating behavior, broken physics, and long-duration incoherence.
L1669	TENSIONS_CONTRADICTIONS	item_04	ai-prompting-and-description.md:L14982	Visualize as one stark diagram: Interpolation between two videos can produce smooth transitions without representing any possible path through the world.
L1670	TENSIONS_CONTRADICTIONS	item_05	ai-prompting-and-description.md:L14986	Visualize as one stark diagram: The Minecraft example is framed as simulation of a digital world, but visual imitation of gameplay does not establish that the model has learned the game’s rule system, inventory logic, collision mechanics, or persistent hidden state.
L1671	TENSIONS_CONTRADICTIONS	item_06	ai-prompting-and-description.md:L14990	Visualize as one stark diagram: The claim that 3D consistency emerges without explicit 3D inductive bias is important, but training video already contains structured projections of three-dimensional scenes.
L1672	TENSIONS_CONTRADICTIONS	item_07	ai-prompting-and-description.md:L14994	Visualize as one stark diagram: Scaling evidence is presented qualitatively through selected outputs at different compute levels.
L1673	TENSIONS_CONTRADICTIONS	item_08	ai-prompting-and-description.md:L14998	Visualize as one stark diagram: The report calls Sora a generalist model while withholding model architecture details, training data composition, evaluation procedures, and implementation specifics.
L1674	TENSIONS_CONTRADICTIONS	item_09	ai-prompting-and-description.md:L15002	Visualize as one stark diagram: Prompt expansion improves adherence but complicates attribution.
L1675	TENSIONS_CONTRADICTIONS	item_01	ai-prompting-and-description.md:L15199	Visualize as one stark diagram: The page defines world models as systems that “understand” physical dynamics, but most described capabilities concern generation, prediction, curation, and post-training.
L1676	TENSIONS_CONTRADICTIONS	item_02	ai-prompting-and-description.md:L15203	Visualize as one stark diagram: Traditional rule-based simulators are described as precise but brittle, while learned models are presented as adaptive and general.
L1677	TENSIONS_CONTRADICTIONS	item_03	ai-prompting-and-description.md:L15207	Visualize as one stark diagram: The claim that autoregressive models “understand cause and effect in time” is stronger than the architecture alone supports.
L1678	TENSIONS_CONTRADICTIONS	item_04	ai-prompting-and-description.md:L15211	Visualize as one stark diagram: The page says diffusion models refine outputs simultaneously and provide stronger spatial consistency, but diffusion still proceeds through multiple denoising steps.
L1679	TENSIONS_CONTRADICTIONS	item_05	ai-prompting-and-description.md:L15215	Visualize as one stark diagram: Synthetic data are presented as enabling performance on unseen situations.
L1680	TENSIONS_CONTRADICTIONS	item_06	ai-prompting-and-description.md:L15219	Visualize as one stark diagram: Photorealism is presented as helping close the sim-to-real gap.
L1681	TENSIONS_CONTRADICTIONS	item_07	ai-prompting-and-description.md:L15223	Visualize as one stark diagram: The claim that one foundation model can generalize across embodiments underplays how strongly action possibilities depend on body geometry, sensors, actuators, control frequency, balance, energy, and failure tolerance.
L1682	TENSIONS_CONTRADICTIONS	item_08	ai-prompting-and-description.md:L15227	Visualize as one stark diagram: The page describes reinforcement learning as giving models the ability to “reason for themselves.” RL optimizes behavior against rewards; it does not by itself establish reasoning, self-understanding, or reliable internal deliberation.
L1683	TENSIONS_CONTRADICTIONS	item_09	ai-prompting-and-description.md:L15231	Visualize as one stark diagram: The system is promoted as accelerating development from years to months, but the hidden labor of data acquisition, annotation, simulator calibration, safety evaluation, hardware integration, and domain validation remains substantial.
L1684	TENSIONS_CONTRADICTIONS	item_01	ai-prompting-and-description.md:L15420	Visualize as one stark diagram: DeepMind defines a world model as predicting how an environment evolves and how actions affect it, but the demonstrated action space is mostly navigation.
L1685	TENSIONS_CONTRADICTIONS	item_02	ai-prompting-and-description.md:L15424	Visualize as one stark diagram: Promptable world events are described as counterfactual interventions, yet they are often externally imposed scene edits rather than consequences of agent action.
L1686	TENSIONS_CONTRADICTIONS	item_03	ai-prompting-and-description.md:L15428	Visualize as one stark diagram: The system is praised for consistency lasting several minutes, while one minute of visual memory and a few minutes of interaction remain extremely short relative to real tasks, institutions, journeys, or embodied learning.
L1687	TENSIONS_CONTRADICTIONS	item_04	ai-prompting-and-description.md:L15432	Visualize as one stark diagram: Frame-by-frame generation allows rich dynamic environments but also creates compounding error.
L1688	TENSIONS_CONTRADICTIONS	item_05	ai-prompting-and-description.md:L15436	Visualize as one stark diagram: The comparison with NeRFs and Gaussian splatting emphasizes dynamism, but explicit 3D representations offer inspectable geometry and stronger viewpoint consistency.
L1689	TENSIONS_CONTRADICTIONS	item_06	ai-prompting-and-description.md:L15440	Visualize as one stark diagram: The model is presented as useful for embodied-agent training, yet its environments may lack stable affordances, collision rules, object properties, and reproducible transitions.
L1690	TENSIONS_CONTRADICTIONS	item_07	ai-prompting-and-description.md:L15444	Visualize as one stark diagram: The natural-world examples demonstrate striking appearance, not validated ecology or physics.
L1691	TENSIONS_CONTRADICTIONS	item_08	ai-prompting-and-description.md:L15448	Visualize as one stark diagram: The system can simulate recognizable locations and historical settings while admitting geographic inaccuracy.
L1692	TENSIONS_CONTRADICTIONS	item_09	ai-prompting-and-description.md:L15452	Visualize as one stark diagram: The release frames limited access as responsible development, but restricted access also prevents independent auditing of consistency, memorization, dataset provenance, failure rates, and safety claims.
L1693	TENSIONS_CONTRADICTIONS	item_01	ai-prompting-and-description.md:L15669	Visualize as one stark diagram: The survey defines world models functionally through downstream usefulness.
L1694	TENSIONS_CONTRADICTIONS	item_02	ai-prompting-and-description.md:L15673	Visualize as one stark diagram: Low-level motor commands and high-level language instructions are both treated as “actions.” Yet a motor command intervenes physically, while an instruction specifies a desired outcome.
L1695	TENSIONS_CONTRADICTIONS	item_03	ai-prompting-and-description.md:L15677	Visualize as one stark diagram: Tighter integration promises stronger performance but weaker diagnosis.
L1696	TENSIONS_CONTRADICTIONS	item_04	ai-prompting-and-description.md:L15681	Visualize as one stark diagram: Latent world models avoid the cost and redundancy of pixels, but their internal predictions become harder to audit.
L1697	TENSIONS_CONTRADICTIONS	item_05	ai-prompting-and-description.md:L15685	Visualize as one stark diagram: A simulator used to train and score a policy can reward behavior that exploits simulator errors.
L1698	TENSIONS_CONTRADICTIONS	item_06	ai-prompting-and-description.md:L15689	Visualize as one stark diagram: Co-evolution can repair simulator weaknesses, but it can also create a closed epistemic circuit.
L1699	TENSIONS_CONTRADICTIONS	item_07	ai-prompting-and-description.md:L15693	Visualize as one stark diagram: The literature emphasizes video because visual data scale readily, yet manipulation depends heavily on force, touch, proprioception, compliance, weight, friction, and damage.
L1700	TENSIONS_CONTRADICTIONS	item_08	ai-prompting-and-description.md:L15697	Visualize as one stark diagram: Benchmark gains often compare complete systems with different backbones, data, policy heads, inference budgets, and training recipes.
L1701	TENSIONS_CONTRADICTIONS	item_09	ai-prompting-and-description.md:L15701	Visualize as one stark diagram: The survey describes a trend toward foundation-scale generality while acknowledging that cross-embodiment transfer remains dependent on specific action spaces and bodies.
L1702	TENSIONS_CONTRADICTIONS	item_01	ai-prompting-and-description.md:L15898	Visualize as one stark diagram: The paper calls WorldDreamer a “general world model,” but action conditioning is demonstrated principally in the narrow domain of autonomous driving, using yaw and velocity.
L1703	TENSIONS_CONTRADICTIONS	item_02	ai-prompting-and-description.md:L15902	Visualize as one stark diagram: The claim that the model learns “general world physics and motions” is supported mainly through visual examples.
L1704	TENSIONS_CONTRADICTIONS	item_03	ai-prompting-and-description.md:L15906	Visualize as one stark diagram: Masked-token reconstruction can exploit information from surrounding frames unavailable in real-time prediction.
L1705	TENSIONS_CONTRADICTIONS	item_04	ai-prompting-and-description.md:L15910	Visualize as one stark diagram: The paper invokes a Markovian assumption to justify predicting multiple tokens in parallel.
L1706	TENSIONS_CONTRADICTIONS	item_05	ai-prompting-and-description.md:L15914	Visualize as one stark diagram: The same token mask is applied across frames to prevent leakage from adjacent visual similarity.
L1707	TENSIONS_CONTRADICTIONS	item_06	ai-prompting-and-description.md:L15918	Visualize as one stark diagram: Training simultaneously on videos and sets of independent images increases data volume, but the image batches contain no genuine temporal relation.
L1708	TENSIONS_CONTRADICTIONS	item_07	ai-prompting-and-description.md:L15922	Visualize as one stark diagram: Detailed captions are generated by Gemini, meaning the visual-language relationship is partially authored by another model.
L1709	TENSIONS_CONTRADICTIONS	item_08	ai-prompting-and-description.md:L15926	Visualize as one stark diagram: The self-collected dataset filters out clips with slow optical flow.
L1710	TENSIONS_CONTRADICTIONS	item_09	ai-prompting-and-description.md:L15930	Visualize as one stark diagram: Parallel decoding provides major speed advantages, but committing high-confidence tokens early can lock in a globally wrong interpretation.
L1711	TENSIONS_CONTRADICTIONS	item_10	ai-prompting-and-description.md:L15934	Visualize as one stark diagram: The paper presents masked generation as a route to general world modeling, yet its outputs are only 24 frames at 192×320 resolution.
L1712	TENSIONS_CONTRADICTIONS	item_01	ai-prompting-and-description.md:L16180	Visualize as one stark diagram: A video model may know what manipulation should look like while failing to preserve the actual robot.
L1713	TENSIONS_CONTRADICTIONS	item_02	ai-prompting-and-description.md:L16184	Visualize as one stark diagram: The argument that inverse dynamics is easier assumes the predicted future is correct and physically reachable.
L1714	TENSIONS_CONTRADICTIONS	item_03	ai-prompting-and-description.md:L16188	Visualize as one stark diagram: Video quality and policy quality may correlate because both improve with scale, data curation, and stronger backbones.
L1715	TENSIONS_CONTRADICTIONS	item_04	ai-prompting-and-description.md:L16192	Visualize as one stark diagram: Representation-only systems challenge the term “world-action model.” If future generation is skipped at inference and only pretrained features remain, the architecture may function more like a temporally informed policy than an active world model.
L1716	TENSIONS_CONTRADICTIONS	item_05	ai-prompting-and-description.md:L16196	Visualize as one stark diagram: Action-as-image avoids modality mismatch but introduces semantic mismatch.
L1717	TENSIONS_CONTRADICTIONS	item_06	ai-prompting-and-description.md:L16200	Visualize as one stark diagram: WAMs promise better physical grounding while relying overwhelmingly on camera-visible evidence.
L1718	TENSIONS_CONTRADICTIONS	item_07	ai-prompting-and-description.md:L16204	Visualize as one stark diagram: The article presents WAMs as a second major recipe, but the strongest projected endpoint is a hybrid that combines WAM and VLA components.
L1719	TENSIONS_CONTRADICTIONS	item_08	ai-prompting-and-description.md:L16208	Visualize as one stark diagram: Reported comparisons mix different models, training corpora, parameter counts, action representations, inference budgets, embodiments, and evaluation environments.
L1720	TENSIONS_CONTRADICTIONS	item_09	ai-prompting-and-description.md:L16212	Visualize as one stark diagram: Open video backbones democratize WAM research downstream while concentrating upstream power.
L1721	TENSIONS_CONTRADICTIONS	item_01	ai-prompting-and-description.md:L16407	Visualize as one stark diagram: The language gives the programmer precise control over images while requiring thought at the level of memory locations, scanner positions, raster coordinates, and modulo arithmetic.
L1722	TENSIONS_CONTRADICTIONS	item_02	ai-prompting-and-description.md:L16411	Visualize as one stark diagram: The system describes scanners as intuitive conceptual devices, yet their behavior is constrained by machine-specific storage topology.
L1723	TENSIONS_CONTRADICTIONS	item_03	ai-prompting-and-description.md:L16415	Visualize as one stark diagram: The movie language abstracts animation into high-level operations, but many operations remain tied to integer grids and rectangular regions.
L1724	TENSIONS_CONTRADICTIONS	item_04	ai-prompting-and-description.md:L16419	Visualize as one stark diagram: The system allows several scanners to occupy the same square, but their internal memories may disagree after one modifies the value.
L1725	TENSIONS_CONTRADICTIONS	item_05	ai-prompting-and-description.md:L16423	Visualize as one stark diagram: The camera’s grey-scale image is produced through character glyphs and deliberate optical defocus.
L1726	TENSIONS_CONTRADICTIONS	item_06	ai-prompting-and-description.md:L16427	Visualize as one stark diagram: The system compresses repeated frames efficiently, but final temporal realization still depends on optical printing and laboratory work.
L1727	TENSIONS_CONTRADICTIONS	item_07	ai-prompting-and-description.md:L16431	Visualize as one stark diagram: Dynamic transformations such as dissolve and zoom are predefined algorithms rather than continuously parameterized spatial models.
L1728	TENSIONS_CONTRADICTIONS	item_08	ai-prompting-and-description.md:L16435	Visualize as one stark diagram: The language is extensible through macros, but this extensibility can also fragment practice.
L1729	TENSIONS_CONTRADICTIONS	item_01	ai-prompting-and-description.md:L16707	Visualize as one stark diagram: The chapter describes computers as protection from human ignorance, but this transfers judgment to whoever designs the system.
L1730	TENSIONS_CONTRADICTIONS	item_02	ai-prompting-and-description.md:L16711	Visualize as one stark diagram: The language of symbiosis suggests ecological reciprocity while obscuring asymmetry.
L1731	TENSIONS_CONTRADICTIONS	item_03	ai-prompting-and-description.md:L16715	Visualize as one stark diagram: The computer is presented as liberating humanity from specialization, yet the practice described requires unusual concentrations of mathematical, engineering, artistic, and institutional expertise.
L1732	TENSIONS_CONTRADICTIONS	item_04	ai-prompting-and-description.md:L16719	Visualize as one stark diagram: The chapter celebrates the computer as an active collaborator while repeatedly asserting that it performs only prescribed operations.
L1733	TENSIONS_CONTRADICTIONS	item_05	ai-prompting-and-description.md:L16723	Visualize as one stark diagram: Mallary’s six levels treat removal of the human artist as the apex of cybernetic development.
L1734	TENSIONS_CONTRADICTIONS	item_06	ai-prompting-and-description.md:L16727	Visualize as one stark diagram: The proposed psychedelic computer can optimize or steer emotion, but the text treats this mainly as expanded consciousness.
L1735	TENSIONS_CONTRADICTIONS	item_07	ai-prompting-and-description.md:L16731	Visualize as one stark diagram: The new artist is imagined as one individual fluent in both art and technology.
L1736	TENSIONS_CONTRADICTIONS	item_08	ai-prompting-and-description.md:L16735	Visualize as one stark diagram: Youngblood criticizes simplistic computer art whose importance derives only from its technological origin, yet his descriptions sometimes grant technological novelty an almost automatic transcendental force.
L1737	TENSIONS_CONTRADICTIONS	item_09	ai-prompting-and-description.md:L16739	Visualize as one stark diagram: The chapter’s utopian abundance assumes materials become interchangeable and knowledge becomes the unique resource.
L1738	TENSIONS_CONTRADICTIONS	item_01	ai-prompting-and-description.md:L16970	Visualize as one stark diagram: Whitney borrows music as the model for visual time while repeatedly warning against simplistic equivalence between sound and image.
L1739	TENSIONS_CONTRADICTIONS	item_02	ai-prompting-and-description.md:L16974	Visualize as one stark diagram: Whole-number ratios produce clear periodic resonances, but perceptual value cannot be reduced to mathematical consonance.
L1740	TENSIONS_CONTRADICTIONS	item_03	ai-prompting-and-description.md:L16978	Visualize as one stark diagram: He rejects randomness as aimless motion, yet unexpected variation can create tension, rupture, and renewal.
L1741	TENSIONS_CONTRADICTIONS	item_04	ai-prompting-and-description.md:L16982	Visualize as one stark diagram: The theory treats resolution as emotionally central, but some temporal works deliberately sustain ambiguity, suspension, or irreconcilable conflict.
L1742	TENSIONS_CONTRADICTIONS	item_05	ai-prompting-and-description.md:L16986	Visualize as one stark diagram: Whitney criticizes abstraction because it draws attention toward the objects rather than the dynamics, but his preferred geometric forms are conventionally classified as abstract.
L1743	TENSIONS_CONTRADICTIONS	item_06	ai-prompting-and-description.md:L16990	Visualize as one stark diagram: The search for innate visual harmony risks universalizing historically and culturally situated aesthetic preferences.
L1744	TENSIONS_CONTRADICTIONS	item_07	ai-prompting-and-description.md:L16994	Visualize as one stark diagram: His field model activates all elements continuously, yet stillness can be a powerful temporal operation.
L1745	TENSIONS_CONTRADICTIONS	item_08	ai-prompting-and-description.md:L16998	Visualize as one stark diagram: The comparison with music privileges organized temporal continuity and can marginalize cinematic operations such as discontinuity, montage, interruption, narrative ellipsis, and incompatible temporal registers.
L1746	TENSIONS_CONTRADICTIONS	item_09	ai-prompting-and-description.md:L17002	Visualize as one stark diagram: The theory describes viewer engagement as a dialogue with the composer, but the actual work is fixed before reception.
L1747	TENSIONS_CONTRADICTIONS	item_01	ai-prompting-and-description.md:L17257	Visualize as one stark diagram: The metaphor of culture as a “program” clarifies how symbols guide action, but risks making people appear as machines executing inherited instructions.
L1748	TENSIONS_CONTRADICTIONS	item_02	ai-prompting-and-description.md:L17261	Visualize as one stark diagram: Geertz attacks the separation of biological, psychological, social, and cultural levels, yet his own account sometimes distinguishes innate capacities from cultural realization too neatly.
L1749	TENSIONS_CONTRADICTIONS	item_03	ai-prompting-and-description.md:L17265	Visualize as one stark diagram: The essay rejects empty universals but still needs general claims about humans: plasticity, incompleteness, symbolic dependence, and cultural-biological coevolution.
L1750	TENSIONS_CONTRADICTIONS	item_04	ai-prompting-and-description.md:L17269	Visualize as one stark diagram: Culture is presented as necessary for ordering behavior, but cultural systems can also produce disorientation, contradiction, domination, and trauma.
L1751	TENSIONS_CONTRADICTIONS	item_05	ai-prompting-and-description.md:L17273	Visualize as one stark diagram: The emphasis on becoming human through particular culture can slide toward cultural enclosure.
L1752	TENSIONS_CONTRADICTIONS	item_06	ai-prompting-and-description.md:L17277	Visualize as one stark diagram: Geertz treats particularity as the route to human truth, yet interpretation of particularity still depends on theoretical abstraction.
L1753	TENSIONS_CONTRADICTIONS	item_07	ai-prompting-and-description.md:L17281	Visualize as one stark diagram: The positive-feedback account of biological and cultural development is powerful but can become teleological.
L1754	TENSIONS_CONTRADICTIONS	item_08	ai-prompting-and-description.md:L17285	Visualize as one stark diagram: Culture supplies the symbolic means by which emotions are formed and recognized, but affect also exceeds explicit cultural coding through bodily states, developmental histories, and situations that resist available names.
L1755	TENSIONS_CONTRADICTIONS	item_09	ai-prompting-and-description.md:L17289	Visualize as one stark diagram: The claim that every person is a cultural artifact foregrounds formation but can understate power.
L1756	TENSIONS_CONTRADICTIONS	item_01	ai-prompting-and-description.md:L17534	Visualize as one stark diagram: Sterrett’s historical case is cumulative but circumstantial.
L1757	TENSIONS_CONTRADICTIONS	item_02	ai-prompting-and-description.md:L17538	Visualize as one stark diagram: The analogy between Tractarian objects and physical dimensions is illuminating but imperfect.
L1758	TENSIONS_CONTRADICTIONS	item_03	ai-prompting-and-description.md:L17542	Visualize as one stark diagram: Physical similarity explains engineered quantitative models especially well.
L1759	TENSIONS_CONTRADICTIONS	item_04	ai-prompting-and-description.md:L17546	Visualize as one stark diagram: Intertranslatability requires machines, conventions, and trained users.
L1760	TENSIONS_CONTRADICTIONS	item_05	ai-prompting-and-description.md:L17550	Visualize as one stark diagram: A physically similar model preserves only selected behaviors.
L1761	TENSIONS_CONTRADICTIONS	item_06	ai-prompting-and-description.md:L17554	Visualize as one stark diagram: The courtroom model mixes two different orders: physical causality and normative responsibility.
L1762	TENSIONS_CONTRADICTIONS	item_07	ai-prompting-and-description.md:L17558	Visualize as one stark diagram: The parallel between removing arithmetic constants from general physical equations and removing logical constants from propositions may be structurally suggestive without being philosophically identical.
L1763	TENSIONS_CONTRADICTIONS	item_08	ai-prompting-and-description.md:L17562	Visualize as one stark diagram: Sterrett emphasizes measurement systems as securing contact with reality, but systems of measurement are themselves historically designed, standardized, and institutionally enforced.
