line_id	section	field	source	visual_seed
L0949	TENSIONS_CONTRADICTIONS	item_01	ai-prompting-and-description.md:L575	Visualize as one stark diagram: The article warns that AI infrastructure could raise electricity prices and emissions while celebrating unprecedented construction speed and enormous new facilities.
L0950	TENSIONS_CONTRADICTIONS	item_02	ai-prompting-and-description.md:L579	Visualize as one stark diagram: The headline promises to clarify the “backbone” of AI, but the article never settles on a definition.
L0951	TENSIONS_CONTRADICTIONS	item_03	ai-prompting-and-description.md:L583	Visualize as one stark diagram: The claim that ninety-five per cent of businesses “utilize AI” is used to establish near-universal adoption, but “in some way” can include trivial experimentation, bundled software features, failed pilots, or isolated employee use.
L0952	TENSIONS_CONTRADICTIONS	item_04	ai-prompting-and-description.md:L587	Visualize as one stark diagram: The article presents energy-aware infrastructure planning as farsighted while also praising projects whose defining priority is delivery speed.
L0953	TENSIONS_CONTRADICTIONS	item_05	ai-prompting-and-description.md:L591	Visualize as one stark diagram: “Bet on math” is offered as a durable investment principle, but the article provides no bridge between AI systems performing mathematical notation well and the commercial or scientific value of mathematical investment.
L0954	TENSIONS_CONTRADICTIONS	item_01	ai-prompting-and-description.md:L654	Visualize as one stark diagram: The article correctly emphasizes that the model does not execute tools, yet repeatedly says that the model “does something,” “triggers actions,” or becomes capable of interacting with the world.
L0955	TENSIONS_CONTRADICTIONS	item_02	ai-prompting-and-description.md:L658	Visualize as one stark diagram: Tool choice is presented as evidence of agency, but the examples involve classification among developer-provided functions in response to explicit requests.
L0956	TENSIONS_CONTRADICTIONS	item_03	ai-prompting-and-description.md:L662	Visualize as one stark diagram: The system is described as using real data to prevent hallucination, but external data does not automatically produce truthful answers.
L0957	TENSIONS_CONTRADICTIONS	item_04	ai-prompting-and-description.md:L666	Visualize as one stark diagram: The examples treat execution as mechanically following model-generated arguments.
L0958	TENSIONS_CONTRADICTIONS	item_05	ai-prompting-and-description.md:L670	Visualize as one stark diagram: The final weather response adds an unsolicited recommendation that it is a good day to be outside, despite possessing only temperature data and a weather code.
L0959	TENSIONS_CONTRADICTIONS	item_01	ai-prompting-and-description.md:L733	Visualize as one stark diagram: The model is described as probably the most powerful text-only open-weights LLM, yet the evidence combines one aggregate benchmark, one coding leaderboard, pricing, and two idiosyncratic SVG prompts.
L0960	TENSIONS_CONTRADICTIONS	item_02	ai-prompting-and-description.md:L737	Visualize as one stark diagram: Its MIT license and downloadable weights imply accessibility, while its scale makes meaningful self-hosting inaccessible to most individuals and small organizations.
L0961	TENSIONS_CONTRADICTIONS	item_03	ai-prompting-and-description.md:L741	Visualize as one stark diagram: The article celebrates its low token prices while documenting unusually high token usage.
L0962	TENSIONS_CONTRADICTIONS	item_04	ai-prompting-and-description.md:L745	Visualize as one stark diagram: The Code Arena ranking is treated as especially impressive because the model lacks image input, but that may expose a limitation in the evaluation rather than an unexpected model strength.
L0963	TENSIONS_CONTRADICTIONS	item_05	ai-prompting-and-description.md:L749	Visualize as one stark diagram: The SVG examples are valuable precisely because they resist leaderboard abstraction, yet their interpretation remains subjective and extremely low-sample.
L0964	TENSIONS_CONTRADICTIONS	item_01	ai-prompting-and-description.md:L812	Visualize as one stark diagram: Altman says the data has proved scaling skeptics wrong while conceding that models remain substantially worse than humans on long-horizon tasks requiring judgment.
L0965	TENSIONS_CONTRADICTIONS	item_02	ai-prompting-and-description.md:L816	Visualize as one stark diagram: The claim that researchers were “too confident” about scaling limits is delivered with comparable confidence about scaling’s future.
L0966	TENSIONS_CONTRADICTIONS	item_03	ai-prompting-and-description.md:L820	Visualize as one stark diagram: One mathematical result is used to support the claim that LLMs can create new knowledge.
L0967	TENSIONS_CONTRADICTIONS	item_04	ai-prompting-and-description.md:L824	Visualize as one stark diagram: World models are acknowledged as important for robotics but positioned as compatible with continued confidence in LLM scaling.
L0968	TENSIONS_CONTRADICTIONS	item_05	ai-prompting-and-description.md:L828	Visualize as one stark diagram: The rhetoric portrays skepticism as obstruction, but scientific skepticism can also prevent benchmark overfitting, unsupported generalization, and capital-intensive lock-in.
L0969	TENSIONS_CONTRADICTIONS	item_01	ai-prompting-and-description.md:L891	Visualize as one stark diagram: The article insists that the initiative was never merely about receiving a grant, while its central argument depends on the transformative scale of the money Baltimore did not receive.
L0970	TENSIONS_CONTRADICTIONS	item_02	ai-prompting-and-description.md:L895	Visualize as one stark diagram: Thomas argues that Baltimore was unfairly excluded from earlier growth-center logic because it lies near already successful hubs.
L0971	TENSIONS_CONTRADICTIONS	item_03	ai-prompting-and-description.md:L899	Visualize as one stark diagram: The proposal is framed as a pathway from innovation to broad opportunity, but the article does not specify how investment would have prevented familiar outcomes such as professional-class capture, land appreciation…
L0972	TENSIONS_CONTRADICTIONS	item_04	ai-prompting-and-description.md:L903	Visualize as one stark diagram: The author criticizes the federal government for authorizing ten billion dollars but deploying less than one billion, while also acknowledging that many Baltimore proposals were new, unproven, and assembled under severe time pressure.
L0973	TENSIONS_CONTRADICTIONS	item_05	ai-prompting-and-description.md:L907	Visualize as one stark diagram: The piece opposes the claim that rejection may have benefited Baltimore, yet its own evidence shows that the competition forced regional alignment, generated commitments, created institutional capacity, and clarified strategy.
L0974	TENSIONS_CONTRADICTIONS	item_01	ai-prompting-and-description.md:L1049	Visualize as one stark diagram: The project is framed as “freeing the law,” yet the Hugging Face release uses a CC BY-NC 4.0 licence, and thousands of additional collected documents are described as available to researchers through a signed-release process.
L0975	TENSIONS_CONTRADICTIONS	item_02	ai-prompting-and-description.md:L1053	Visualize as one stark diagram: The dataset card describes approximately 2.21 million “ordinances,” while elsewhere specifying that the unit of analysis is a chunk derived from a legal document.
L0976	TENSIONS_CONTRADICTIONS	item_03	ai-prompting-and-description.md:L1057	Visualize as one stark diagram: The paper argues that position inside a code carries substantive information and warns that chunking strategies can lose this documentary structure.
L0977	TENSIONS_CONTRADICTIONS	item_04	ai-prompting-and-description.md:L1061	Visualize as one stark diagram: The project presents model-generated dimensions as tools for discovering national legal patterns, but the model’s judgments may also encode assumptions from its training data, prompt wording, OCR quality, document length, and legal register.
L0978	TENSIONS_CONTRADICTIONS	item_05	ai-prompting-and-description.md:L1065	Visualize as one stark diagram: The accessible preview itself illustrates the risk of aggregate confidence: a provision requiring municipal meetings to be public is assigned the topic “Nuisance.” The dataset acknowledges expected noise at taxonomy boun…
L0979	TENSIONS_CONTRADICTIONS	item_01	ai-prompting-and-description.md:L1532	Visualize as one stark diagram: The narrative presents variety as the route to transferable expertise, yet all its strongest examples involve decades of highly domain-specific exposure.
L0980	TENSIONS_CONTRADICTIONS	item_02	ai-prompting-and-description.md:L1536	Visualize as one stark diagram: Chunking is used to explain prediction, memory, perception, and learning as though they were one mechanism.
L0981	TENSIONS_CONTRADICTIONS	item_03	ai-prompting-and-description.md:L1540	Visualize as one stark diagram: The video argues that experts do not possess exceptional reflexes, but this can create a false opposition.
L0982	TENSIONS_CONTRADICTIONS	item_04	ai-prompting-and-description.md:L1544	Visualize as one stark diagram: The claim that learners should be wrong roughly fifteen per cent of the time is presented as a general scientific threshold, while desirable difficulty depends heavily on task type, feedback quality, learner expertise, motivation, and consequences of error.
L0983	TENSIONS_CONTRADICTIONS	item_05	ai-prompting-and-description.md:L1548	Visualize as one stark diagram: The closing advice encourages prediction in meetings and everyday situations, but social settings are reflexive: people respond to being interpreted, conceal intentions, and change strategies.
L0984	TENSIONS_CONTRADICTIONS	item_01	ai-prompting-and-description.md:L1801	Visualize as one stark diagram: Craik attacks philosophy’s pursuit of exact verbal definitions, arguing that concepts should be made “exact in the right way” through experimental use.
L0985	TENSIONS_CONTRADICTIONS	item_02	ai-prompting-and-description.md:L1805	Visualize as one stark diagram: The book declares experiment the final arbiter, but its central proposal is built largely from analogies among nervous systems, calculating machines, instruments, conditioned responses, and physical models.
L0986	TENSIONS_CONTRADICTIONS	item_03	ai-prompting-and-description.md:L1809	Visualize as one stark diagram: Craik insists that a model need not pictorially resemble its object, only preserve relevant relational structure.
L0987	TENSIONS_CONTRADICTIONS	item_04	ai-prompting-and-description.md:L1813	Visualize as one stark diagram: The theory explains the adaptive function of thought more convincingly than the existence of conscious experience.
L0988	TENSIONS_CONTRADICTIONS	item_05	ai-prompting-and-description.md:L1817	Visualize as one stark diagram: Craik values explanations with fewer independent assumptions while defending mechanism-seeking that introduces additional intermediate entities and processes.
L0989	TENSIONS_CONTRADICTIONS	item_01	ai-prompting-and-description.md:L1880	Visualize as one stark diagram: The article calls harness engineering newly important while describing functions that have long existed under names such as application architecture, middleware, orchestration, safety engineering, human-computer interaction, and distributed systems.
L0990	TENSIONS_CONTRADICTIONS	item_02	ai-prompting-and-description.md:L1884	Visualize as one stark diagram: The airport analogy portrays the harness as neutral support infrastructure, but airports do not merely enable airplanes.
L0991	TENSIONS_CONTRADICTIONS	item_03	ai-prompting-and-description.md:L1888	Visualize as one stark diagram: User happiness is presented as evidence that harness engineering is working, but pleasant interaction can conflict with truthfulness, autonomy, privacy, and safety.
L0992	TENSIONS_CONTRADICTIONS	item_04	ai-prompting-and-description.md:L1892	Visualize as one stark diagram: The article emphasizes controlling and constraining agents while also promising greater autonomy and capability.
L0993	TENSIONS_CONTRADICTIONS	item_05	ai-prompting-and-description.md:L1896	Visualize as one stark diagram: Multi-agent orchestration is treated as an escalation in sophistication, but adding agents also multiplies error propagation, duplicated work, contradictory state, security boundaries, and attribution problems.
L0994	TENSIONS_CONTRADICTIONS	item_01	ai-prompting-and-description.md:L1959	Visualize as one stark diagram: Critics argue that Anthropic produced the policy outcome by exaggerating danger, yet the ban itself validates the company’s claim that governments may regard frontier models as security-sensitive.
L0995	TENSIONS_CONTRADICTIONS	item_02	ai-prompting-and-description.md:L1963	Visualize as one stark diagram: The FT analysis reports that Anthropic’s risk language has halved since 2023, even as the article frames the company as increasingly responsible for regulatory escalation.
L0996	TENSIONS_CONTRADICTIONS	item_03	ai-prompting-and-description.md:L1967	Visualize as one stark diagram: The administration is described as pro-innovation and hostile to safety regulation, but it imposed a sweeping restriction on the most advanced domestic model.
L0997	TENSIONS_CONTRADICTIONS	item_04	ai-prompting-and-description.md:L1971	Visualize as one stark diagram: Anthropic is criticized both for initially limiting Mythos access and for allegedly downplaying a guardrail concern when approached by government.
L0998	TENSIONS_CONTRADICTIONS	item_05	ai-prompting-and-description.md:L1975	Visualize as one stark diagram: The article treats OpenAI’s lower frequency of risk language as a meaningful comparison, but the firms may use different vocabularies, channels, document types, and communication strategies.
L0999	TENSIONS_CONTRADICTIONS	item_01	ai-prompting-and-description.md:L2038	Visualize as one stark diagram: Doctorow argues that AI demand is being imposed on unwilling workers while also highlighting widespread informal and locally chosen uses.
L1000	TENSIONS_CONTRADICTIONS	item_02	ai-prompting-and-description.md:L2042	Visualize as one stark diagram: The claim that every AI customer and every use loses money is rhetorically powerful but analytically underspecified.
L1001	TENSIONS_CONTRADICTIONS	item_03	ai-prompting-and-description.md:L2046	Visualize as one stark diagram: Doctorow rejects AI exceptionalism while describing its capital bubble as historically exceptional in scale and potential damage.
L1002	TENSIONS_CONTRADICTIONS	item_04	ai-prompting-and-description.md:L2050	Visualize as one stark diagram: The interview treats local computation as ecologically modest, but the productive residue it anticipates—mass availability of cheap GPUs and models—could multiply aggregate consumption through decentralized adoption.
L1003	TENSIONS_CONTRADICTIONS	item_05	ai-prompting-and-description.md:L2054	Visualize as one stark diagram: The centaur/reverse-centaur distinction depends on worker control, yet many work arrangements fall between autonomy and domination.
L1004	TENSIONS_CONTRADICTIONS	item_01	ai-prompting-and-description.md:L2117	Visualize as one stark diagram: The article presents the reform as a response to unemployment while acknowledging that China already produces more than twelve million graduates annually.
L1005	TENSIONS_CONTRADICTIONS	item_02	ai-prompting-and-description.md:L2121	Visualize as one stark diagram: Universities are urged to respond more rapidly to labor markets, yet degree programs require years to approve, staff, teach, and graduate students.
L1006	TENSIONS_CONTRADICTIONS	item_03	ai-prompting-and-description.md:L2125	Visualize as one stark diagram: The reform is framed as replacement of obsolete programs with future-facing ones, but no evidence is supplied that the removed programs were ineffective, low quality, undersubscribed, or causally linked to unemployment.
L1007	TENSIONS_CONTRADICTIONS	item_04	ai-prompting-and-description.md:L2129	Visualize as one stark diagram: The article contrasts Chinese strategic coordination with American institutional autonomy as though these were clean opposites.
L1008	TENSIONS_CONTRADICTIONS	item_05	ai-prompting-and-description.md:L2133	Visualize as one stark diagram: Humanities and languages are reduced while China seeks technological leadership abroad.
L1009	TENSIONS_CONTRADICTIONS	item_01	ai-prompting-and-description.md:L2196	Visualize as one stark diagram: The government restricted Anthropic’s models because of national-security risk while the Five Eyes agencies simultaneously urged organizations to adopt frontier AI urgently for cyber defense.
L1010	TENSIONS_CONTRADICTIONS	item_02	ai-prompting-and-description.md:L2200	Visualize as one stark diagram: Mythos was described publicly as capable of compromising classified systems in hours, but officials later clarified that it identified vulnerabilities in an authorized red-team environment and did not break into the systems.
L1011	TENSIONS_CONTRADICTIONS	item_03	ai-prompting-and-description.md:L2204	Visualize as one stark diagram: The Pentagon’s “supply chain risk” designation implies that Anthropic should not be trusted inside sensitive government systems, while the White House and intelligence agencies pursued a classified N.S.A.
L1012	TENSIONS_CONTRADICTIONS	item_04	ai-prompting-and-description.md:L2208	Visualize as one stark diagram: Officials want the N.S.A. to use alternative models, but the article says Mythos exceeded already high expectations.
L1013	TENSIONS_CONTRADICTIONS	item_05	ai-prompting-and-description.md:L2212	Visualize as one stark diagram: The article frames the loss of access as an accidental consequence of export controls, but Anthropic’s decision to withdraw the models for compliance translated a foreign-access restriction into domestic unavailability.
L1014	TENSIONS_CONTRADICTIONS	item_01	ai-prompting-and-description.md:L2275	Visualize as one stark diagram: Anthropic describes humans as remaining in the driver’s seat, yet one employee reports alternating between feeling irrelevant when automation succeeds and unable to understand the system when it fails.
L1015	TENSIONS_CONTRADICTIONS	item_02	ai-prompting-and-description.md:L2279	Visualize as one stark diagram: The article links AI-driven isolation to broader morale problems involving layoffs, unstable strategy, and distrust of leadership.
L1016	TENSIONS_CONTRADICTIONS	item_03	ai-prompting-and-description.md:L2283	Visualize as one stark diagram: Anthropic responds to diminished interaction with scheduled communal activities.
L1017	TENSIONS_CONTRADICTIONS	item_04	ai-prompting-and-description.md:L2287	Visualize as one stark diagram: Claude’s completion of hundreds of API error fixes is offered as evidence of dramatic productivity, but task volume does not establish maintainability, causal understanding, severity, review burden, or whether similar errors will recur.
L1018	TENSIONS_CONTRADICTIONS	item_05	ai-prompting-and-description.md:L2291	Visualize as one stark diagram: Companies promote reskilling and transparency as remedies while simultaneously using AI participation as a criterion associated with job security.
L1019	TENSIONS_CONTRADICTIONS	item_01	ai-prompting-and-description.md:L2354	Visualize as one stark diagram: The article frames AI as a force that will unlock human creativity while citing automated how-to videos as a major use case.
L1020	TENSIONS_CONTRADICTIONS	item_02	ai-prompting-and-description.md:L2358	Visualize as one stark diagram: YouTube wants to distinguish valuable AI-assisted creativity from “slop,” but its recommendation system has historically rewarded measurable engagement rather than production integrity.
L1021	TENSIONS_CONTRADICTIONS	item_03	ai-prompting-and-description.md:L2362	Visualize as one stark diagram: AI-generated advertising promises lower costs for marketers, but that efficiency can produce an arms race in ad volume and personalization.
L1022	TENSIONS_CONTRADICTIONS	item_04	ai-prompting-and-description.md:L2366	Visualize as one stark diagram: The platform presents AI abundance as expanded opportunity for creators, yet an explosion from an already enormous corpus makes discovery more difficult.
L1023	TENSIONS_CONTRADICTIONS	item_05	ai-prompting-and-description.md:L2370	Visualize as one stark diagram: YouTube’s connection to Google is portrayed as a strategic advantage, but it also creates a conflict of interest.
L1024	TENSIONS_CONTRADICTIONS	item_01	ai-prompting-and-description.md:L2433	Visualize as one stark diagram: The bill seeks to protect children’s data while mandating age estimation and harm detection, both of which may require additional collection, inference, retention, and processing of sensitive information.
L1025	TENSIONS_CONTRADICTIONS	item_02	ai-prompting-and-description.md:L2437	Visualize as one stark diagram: Chatbots must identify themselves as non-human, yet the proposed framework still assumes users may form emotionally consequential relationships with them.
L1026	TENSIONS_CONTRADICTIONS	item_03	ai-prompting-and-description.md:L2441	Visualize as one stark diagram: Independent annual audits promise accountability, but yearly review is poorly matched to models, prompts, safeguards, and product interfaces that can change weekly.
L1027	TENSIONS_CONTRADICTIONS	item_04	ai-prompting-and-description.md:L2445	Visualize as one stark diagram: The legislation requires immediate crisis resources while offering no visible standard for false positives, false negatives, or ambiguous language.
L1028	TENSIONS_CONTRADICTIONS	item_05	ai-prompting-and-description.md:L2449	Visualize as one stark diagram: The proposal is described as comprehensive while key institutional questions remain absent: who defines acceptable risk, who certifies auditors, what evidence regulators may inspect, how appeals work…
L1029	TENSIONS_CONTRADICTIONS	item_01	ai-prompting-and-description.md:L2512	Visualize as one stark diagram: The article describes a global AI sell-off but identifies several distinct triggers: researcher departures, SpaceX borrowing, fading post-IPO enthusiasm, inflation, and expected interest-rate increases.
L1030	TENSIONS_CONTRADICTIONS	item_02	ai-prompting-and-description.md:L2516	Visualize as one stark diagram: Record market highs and substantial year-to-date gains coexist with language suggesting a bubble may be beginning to burst.
L1031	TENSIONS_CONTRADICTIONS	item_03	ai-prompting-and-description.md:L2520	Visualize as one stark diagram: SpaceX is incorporated into the AI-infrastructure story even though its core businesses extend beyond AI.
L1032	TENSIONS_CONTRADICTIONS	item_04	ai-prompting-and-description.md:L2524	Visualize as one stark diagram: The departure of two researchers is presented as a reason for Alphabet’s market decline, yet the article supplies no evidence that their departure materially changes its model capabilities, product roadmap, or revenue.
L1033	TENSIONS_CONTRADICTIONS	item_05	ai-prompting-and-description.md:L2528	Visualize as one stark diagram: The article invokes the dot-com crash while also describing infrastructure spending that produces physical assets, technical capacity, and semiconductor demand.
L1034	TENSIONS_CONTRADICTIONS	item_01	ai-prompting-and-description.md:L2591	Visualize as one stark diagram: The article interprets growth from 33% to 49% as increased adoption while acknowledging that the survey question changed.
L1035	TENSIONS_CONTRADICTIONS	item_02	ai-prompting-and-description.md:L2595	Visualize as one stark diagram: Search summaries are counted as AI use even when users did not request them and may not recognize them as such.
L1036	TENSIONS_CONTRADICTIONS	item_03	ai-prompting-and-description.md:L2599	Visualize as one stark diagram: Respondents distrust companies and government simultaneously.
L1037	TENSIONS_CONTRADICTIONS	item_04	ai-prompting-and-description.md:L2603	Visualize as one stark diagram: People report using chatbots for information, medical guidance, news, emotional support, and companionship while doubting their accuracy and social value.
L1038	TENSIONS_CONTRADICTIONS	item_05	ai-prompting-and-description.md:L2607	Visualize as one stark diagram: The article asks whether trust will catch up with adoption, assuming usage and confidence should eventually converge.
L1039	TENSIONS_CONTRADICTIONS	item_01	ai-prompting-and-description.md:L2670	Visualize as one stark diagram: The article describes HappyHorse as No.
L1040	TENSIONS_CONTRADICTIONS	item_02	ai-prompting-and-description.md:L2674	Visualize as one stark diagram: Blind preference rankings are treated as evidence of enterprise superiority, but evaluators usually judge short outputs for immediate visual appeal.
L1041	TENSIONS_CONTRADICTIONS	item_03	ai-prompting-and-description.md:L2678	Visualize as one stark diagram: The model is portrayed as reducing vendor dependency because it combines modalities in one endpoint, yet enterprise adoption would deepen dependence on Alibaba’s proprietary model, cloud infrastructure, pricing, moderation rules, and regional availability.
L1042	TENSIONS_CONTRADICTIONS	item_04	ai-prompting-and-description.md:L2682	Visualize as one stark diagram: Local European infrastructure is presented as supporting digital sovereignty, while Alibaba’s Pentagon designation raises concerns about geopolitical dependence.
L1043	TENSIONS_CONTRADICTIONS	item_05	ai-prompting-and-description.md:L2686	Visualize as one stark diagram: The article describes the field as contracting to essentially one surviving Chinese provider plus Google, yet open models, specialist vendors, editing systems, and future entrants receive little consideration.
