line_id	section	field	source	visual_seed
L0001	NON_OBVIOUS_INSIGHTS	item_01	ai-prompting-and-description.md:L6	Visualize as one stark diagram: Prompting converts description into interface labor.
L0002	NON_OBVIOUS_INSIGHTS	item_02	ai-prompting-and-description.md:L10	Visualize as one stark diagram: The machine does not simply encourage richer description; it disciplines description.
L0003	NON_OBVIOUS_INSIGHTS	item_03	ai-prompting-and-description.md:L14	Visualize as one stark diagram: “Vibe” functions as a compression protocol.
L0004	NON_OBVIOUS_INSIGHTS	item_04	ai-prompting-and-description.md:L18	Visualize as one stark diagram: The apparent democratization of writerly skill conceals a new hierarchy.
L0005	NON_OBVIOUS_INSIGHTS	item_05	ai-prompting-and-description.md:L22	Visualize as one stark diagram: Prompting relocates authorship from composition to selection.
L0006	NON_OBVIOUS_INSIGHTS	item_01	ai-prompting-and-description.md:L81	Visualize as one stark diagram: Prompt engineering is being used as an epistemic escape hatch.
L0007	NON_OBVIOUS_INSIGHTS	item_02	ai-prompting-and-description.md:L85	Visualize as one stark diagram: The argument quietly changes the object being tested.
L0008	NON_OBVIOUS_INSIGHTS	item_03	ai-prompting-and-description.md:L89	Visualize as one stark diagram: “Good prompting” transfers production costs from the model provider to the user.
L0009	NON_OBVIOUS_INSIGHTS	item_04	ai-prompting-and-description.md:L93	Visualize as one stark diagram: Prompt expertise creates a defensible professional jurisdiction.
L0010	NON_OBVIOUS_INSIGHTS	item_05	ai-prompting-and-description.md:L97	Visualize as one stark diagram: The “slop” debate is displaced from political economy to technique.
L0011	NON_OBVIOUS_INSIGHTS	item_01	ai-prompting-and-description.md:L156	Visualize as one stark diagram: AI does not eliminate the studio; it internalizes the studio inside one person.
L0012	NON_OBVIOUS_INSIGHTS	item_02	ai-prompting-and-description.md:L160	Visualize as one stark diagram: The true productive asset is not generated content but the canon-management system.
L0013	NON_OBVIOUS_INSIGHTS	item_03	ai-prompting-and-description.md:L164	Visualize as one stark diagram: Transmedia becomes a discovery strategy before it becomes a storytelling form.
L0014	NON_OBVIOUS_INSIGHTS	item_04	ai-prompting-and-description.md:L168	Visualize as one stark diagram: The creator’s scarcity shifts from production capacity to editorial attention.
L0015	NON_OBVIOUS_INSIGHTS	item_05	ai-prompting-and-description.md:L172	Visualize as one stark diagram: Audience participation risks becoming unpaid canon production.
L0016	NON_OBVIOUS_INSIGHTS	item_01	ai-prompting-and-description.md:L235	Visualize as one stark diagram: The Odyssey defeats filmmakers because cinema externalizes what the poem keeps morally and ontologically unstable.
L0017	NON_OBVIOUS_INSIGHTS	item_02	ai-prompting-and-description.md:L239	Visualize as one stark diagram: The deepest adaptation problem is not scale but legibility.
L0018	NON_OBVIOUS_INSIGHTS	item_03	ai-prompting-and-description.md:L243	Visualize as one stark diagram: The article treats audience maturity as a production constraint.
L0019	NON_OBVIOUS_INSIGHTS	item_04	ai-prompting-and-description.md:L247	Visualize as one stark diagram: “Faithfulness” is exposed as an institutional fiction rather than an artistic possibility.
L0020	NON_OBVIOUS_INSIGHTS	item_05	ai-prompting-and-description.md:L251	Visualize as one stark diagram: The body becomes cinema’s substitute for poetic authority.
L0021	NON_OBVIOUS_INSIGHTS	item_01	ai-prompting-and-description.md:L314	Visualize as one stark diagram: The “reverse centaur” is less a description of automation than a theory of managerial control.
L0022	NON_OBVIOUS_INSIGHTS	item_02	ai-prompting-and-description.md:L318	Visualize as one stark diagram: The AI bubble is collateralized by hypothetical unpaid wages.
L0023	NON_OBVIOUS_INSIGHTS	item_03	ai-prompting-and-description.md:L322	Visualize as one stark diagram: Failure may still be commercially useful.
L0024	NON_OBVIOUS_INSIGHTS	item_04	ai-prompting-and-description.md:L326	Visualize as one stark diagram: Public outrage and public adoption are not opposites within the investment narrative.
L0025	NON_OBVIOUS_INSIGHTS	item_05	ai-prompting-and-description.md:L330	Visualize as one stark diagram: The consumer is being repositioned as an investor-facing performance indicator.
L0026	NON_OBVIOUS_INSIGHTS	item_01	ai-prompting-and-description.md:L393	Visualize as one stark diagram: The dispute is not really about model capability; it is about who gets to define the meaning of an action.
L0027	NON_OBVIOUS_INSIGHTS	item_02	ai-prompting-and-description.md:L397	Visualize as one stark diagram: Safety refusal can become evidence of regulatory danger rather than evidence of safety.
L0028	NON_OBVIOUS_INSIGHTS	item_03	ai-prompting-and-description.md:L401	Visualize as one stark diagram: The restrictions convert domestic compliance into a competitive disadvantage.
L0029	NON_OBVIOUS_INSIGHTS	item_04	ai-prompting-and-description.md:L405	Visualize as one stark diagram: The government’s action creates a “defender’s asymmetry” before establishing an attacker’s asymmetry.
L0030	NON_OBVIOUS_INSIGHTS	item_05	ai-prompting-and-description.md:L409	Visualize as one stark diagram: The episode reveals that AI security governance is being built around demonstrations rather than validated threat models.
L0031	NON_OBVIOUS_INSIGHTS	item_01	ai-prompting-and-description.md:L472	Visualize as one stark diagram: Neural CAD converts Autodesk’s interface monopoly into a model monopoly.
L0032	NON_OBVIOUS_INSIGHTS	item_02	ai-prompting-and-description.md:L476	Visualize as one stark diagram: The promised democratization may shift expertise rather than remove it.
L0033	NON_OBVIOUS_INSIGHTS	item_03	ai-prompting-and-description.md:L480	Visualize as one stark diagram: Editable geometry is also a mechanism for absorbing AI output into existing liability systems.
L0034	NON_OBVIOUS_INSIGHTS	item_04	ai-prompting-and-description.md:L484	Visualize as one stark diagram: Autodesk is positioning customer history as both the source of future differentiation and the basis of deeper lock-in.
L0035	NON_OBVIOUS_INSIGHTS	item_05	ai-prompting-and-description.md:L488	Visualize as one stark diagram: Neural CAD could standardize design before it visibly copies it.
L0036	NON_OBVIOUS_INSIGHTS	item_01	ai-prompting-and-description.md:L551	Visualize as one stark diagram: “The backbone of AI” is being rhetorically expanded until it includes nearly every asset class surrounding computation.
L0037	NON_OBVIOUS_INSIGHTS	item_02	ai-prompting-and-description.md:L555	Visualize as one stark diagram: The binding constraint is moving from semiconductor performance to institutional permission and physical delivery.
L0038	NON_OBVIOUS_INSIGHTS	item_03	ai-prompting-and-description.md:L559	Visualize as one stark diagram: Energy scarcity is being reframed as an opportunity to expand supply rather than a reason to discipline demand.
L0039	NON_OBVIOUS_INSIGHTS	item_04	ai-prompting-and-description.md:L563	Visualize as one stark diagram: The mathematical continuity of computing undermines the article’s revolution narrative.
L0040	NON_OBVIOUS_INSIGHTS	item_05	ai-prompting-and-description.md:L567	Visualize as one stark diagram: The article’s evidence network is unusually self-referential.
L0041	NON_OBVIOUS_INSIGHTS	item_01	ai-prompting-and-description.md:L630	Visualize as one stark diagram: Tool calling relocates agency from the model to the surrounding software architecture.
L0042	NON_OBVIOUS_INSIGHTS	item_02	ai-prompting-and-description.md:L634	Visualize as one stark diagram: Tool descriptions function as executable governance.
L0043	NON_OBVIOUS_INSIGHTS	item_03	ai-prompting-and-description.md:L638	Visualize as one stark diagram: Structured output creates an illusion of certainty at the most dangerous boundary.
L0044	NON_OBVIOUS_INSIGHTS	item_04	ai-prompting-and-description.md:L642	Visualize as one stark diagram: Parallel tool calling converts ambiguity into simultaneous action.
L0045	NON_OBVIOUS_INSIGHTS	item_05	ai-prompting-and-description.md:L646	Visualize as one stark diagram: The agentic loop turns tool outputs into future premises.
L0046	NON_OBVIOUS_INSIGHTS	item_01	ai-prompting-and-description.md:L709	Visualize as one stark diagram: Open weights are becoming an infrastructure market rather than a local-computing movement.
L0047	NON_OBVIOUS_INSIGHTS	item_02	ai-prompting-and-description.md:L713	Visualize as one stark diagram: GLM-5.2 competes partly by externalizing cost into longer reasoning traces.
L0048	NON_OBVIOUS_INSIGHTS	item_03	ai-prompting-and-description.md:L717	Visualize as one stark diagram: The one-million-token context window shifts the bottleneck from capacity to governance.
L0049	NON_OBVIOUS_INSIGHTS	item_04	ai-prompting-and-description.md:L721	Visualize as one stark diagram: Strong frontend performance without vision suggests that coding benchmarks may reward reconstruction more than perception.
L0050	NON_OBVIOUS_INSIGHTS	item_05	ai-prompting-and-description.md:L725	Visualize as one stark diagram: The pelican and opossum reveal regression hidden by aggregate improvement.
L0051	NON_OBVIOUS_INSIGHTS	item_01	ai-prompting-and-description.md:L788	Visualize as one stark diagram: “Scaling works” functions as both a scientific claim and a capital-allocation doctrine.
L0052	NON_OBVIOUS_INSIGHTS	item_02	ai-prompting-and-description.md:L792	Visualize as one stark diagram: Altman reframes scientific disagreement as psychological incapacity.
L0053	NON_OBVIOUS_INSIGHTS	item_03	ai-prompting-and-description.md:L796	Visualize as one stark diagram: The argument treats isolated breakthroughs as evidence about an entire capability trajectory.
L0054	NON_OBVIOUS_INSIGHTS	item_04	ai-prompting-and-description.md:L800	Visualize as one stark diagram: Scaling may be strongest precisely where evaluation is easiest to externalize.
L0055	NON_OBVIOUS_INSIGHTS	item_05	ai-prompting-and-description.md:L804	Visualize as one stark diagram: The dispute may prematurely narrow the field’s research portfolio.
L0056	NON_OBVIOUS_INSIGHTS	item_01	ai-prompting-and-description.md:L867	Visualize as one stark diagram: The funding loss exposed Baltimore’s organizational weakness more clearly than its technological weakness.
L0057	NON_OBVIOUS_INSIGHTS	item_02	ai-prompting-and-description.md:L871	Visualize as one stark diagram: Federal competitions can reproduce the concentration they are designed to correct.
L0058	NON_OBVIOUS_INSIGHTS	item_03	ai-prompting-and-description.md:L875	Visualize as one stark diagram: The projected benefits function as political counterfactuals that cannot be audited.
L0059	NON_OBVIOUS_INSIGHTS	item_04	ai-prompting-and-description.md:L879	Visualize as one stark diagram: “Storytelling” operates here as infrastructure.
L0060	NON_OBVIOUS_INSIGHTS	item_05	ai-prompting-and-description.md:L883	Visualize as one stark diagram: The Tech Hubs designation created a regional coalition whose continued value now depends on preserving scarcity.
L0061	NON_OBVIOUS_INSIGHTS	item_01	ai-prompting-and-description.md:L1025	Visualize as one stark diagram: LOCUS does not merely expose local law; it creates a computational theory of what law is.
L0062	NON_OBVIOUS_INSIGHTS	item_02	ai-prompting-and-description.md:L1029	Visualize as one stark diagram: The normative scores are synthetic interpretations that risk being mistaken for measured properties of law.
L0063	NON_OBVIOUS_INSIGHTS	item_03	ai-prompting-and-description.md:L1033	Visualize as one stark diagram: County harmonization manufactures geographic comparability by sacrificing jurisdictional meaning.
L0064	NON_OBVIOUS_INSIGHTS	item_04	ai-prompting-and-description.md:L1037	Visualize as one stark diagram: Machine-readable access may increase legal-power asymmetry before it improves public understanding.
L0065	NON_OBVIOUS_INSIGHTS	item_05	ai-prompting-and-description.md:L1041	Visualize as one stark diagram: The public release favors classification over legal verification.
L0066	NON_OBVIOUS_INSIGHTS	item_01	ai-prompting-and-description.md:L1508	Visualize as one stark diagram: Elite anticipation is a form of perceptual compression, but compression also creates blindness.
L0067	NON_OBVIOUS_INSIGHTS	item_02	ai-prompting-and-description.md:L1512	Visualize as one stark diagram: Messi’s walking functions as active model calibration rather than passive observation.
L0068	NON_OBVIOUS_INSIGHTS	item_03	ai-prompting-and-description.md:L1516	Visualize as one stark diagram: Deception works by weaponizing the opponent’s expertise.
L0069	NON_OBVIOUS_INSIGHTS	item_04	ai-prompting-and-description.md:L1520	Visualize as one stark diagram: Prediction is distributed across bodies, spaces, and relationships—not located solely in the focal object.
L0070	NON_OBVIOUS_INSIGHTS	item_05	ai-prompting-and-description.md:L1524	Visualize as one stark diagram: The account quietly replaces reaction with controlled hallucination.
L0071	NON_OBVIOUS_INSIGHTS	item_01	ai-prompting-and-description.md:L1777	Visualize as one stark diagram: Craik turns explanation into an internalized experiment.
L0072	NON_OBVIOUS_INSIGHTS	item_02	ai-prompting-and-description.md:L1781	Visualize as one stark diagram: The book relocates intelligence from stored knowledge to structural correspondence.
L0073	NON_OBVIOUS_INSIGHTS	item_03	ai-prompting-and-description.md:L1785	Visualize as one stark diagram: Craik’s mechanistic project expands the category of “machine” until it can absorb properties previously used to distinguish minds from machines.
L0074	NON_OBVIOUS_INSIGHTS	item_04	ai-prompting-and-description.md:L1789	Visualize as one stark diagram: Meaning becomes artificial causation.
L0075	NON_OBVIOUS_INSIGHTS	item_05	ai-prompting-and-description.md:L1793	Visualize as one stark diagram: The book proposes a recursive economy of explanation.
L0076	NON_OBVIOUS_INSIGHTS	item_01	ai-prompting-and-description.md:L1856	Visualize as one stark diagram: Harness engineering is where AI products acquire their actual behavior.
L0077	NON_OBVIOUS_INSIGHTS	item_02	ai-prompting-and-description.md:L1860	Visualize as one stark diagram: The rise of harness engineering signals that frontier-model advantage is becoming less defensible.
L0078	NON_OBVIOUS_INSIGHTS	item_03	ai-prompting-and-description.md:L1864	Visualize as one stark diagram: Harnesses convert probabilistic failure into organizational responsibility.
L0079	NON_OBVIOUS_INSIGHTS	item_04	ai-prompting-and-description.md:L1868	Visualize as one stark diagram: Agentic AI turns harness engineering into institutional simulation.
L0080	NON_OBVIOUS_INSIGHTS	item_05	ai-prompting-and-description.md:L1872	Visualize as one stark diagram: The harness is likely to become the primary site of user manipulation.
L0081	NON_OBVIOUS_INSIGHTS	item_01	ai-prompting-and-description.md:L1935	Visualize as one stark diagram: Safety discourse is becoming evidence in the regulatory case against the speaker.
L0082	NON_OBVIOUS_INSIGHTS	item_02	ai-prompting-and-description.md:L1939	Visualize as one stark diagram: The episode creates a market incentive for strategic silence.
L0083	NON_OBVIOUS_INSIGHTS	item_03	ai-prompting-and-description.md:L1943	Visualize as one stark diagram: The communications analysis confuses vocabulary frequency with causal influence.
L0084	NON_OBVIOUS_INSIGHTS	item_04	ai-prompting-and-description.md:L1947	Visualize as one stark diagram: Anthropic’s safety identity has become both brand capital and political liability.
L0085	NON_OBVIOUS_INSIGHTS	item_05	ai-prompting-and-description.md:L1951	Visualize as one stark diagram: The export ban may be less about controlling model diffusion than disciplining corporate autonomy.
L0086	NON_OBVIOUS_INSIGHTS	item_01	ai-prompting-and-description.md:L2014	Visualize as one stark diagram: The central product of the AI boom may be managerial permission, not automation.
L0087	NON_OBVIOUS_INSIGHTS	item_02	ai-prompting-and-description.md:L2018	Visualize as one stark diagram: Doctorow’s “world without people” is a theory of elite epistemic avoidance.
L0088	NON_OBVIOUS_INSIGHTS	item_03	ai-prompting-and-description.md:L2022	Visualize as one stark diagram: The bubble’s productive residue depends on who gains control after devaluation.
L0089	NON_OBVIOUS_INSIGHTS	item_04	ai-prompting-and-description.md:L2026	Visualize as one stark diagram: The strongest useful-AI examples are intentionally subordinate systems.
L0090	NON_OBVIOUS_INSIGHTS	item_05	ai-prompting-and-description.md:L2030	Visualize as one stark diagram: Copyright conflict may divert creative labor away from the institutional source of its vulnerability.
L0091	NON_OBVIOUS_INSIGHTS	item_01	ai-prompting-and-description.md:L2093	Visualize as one stark diagram: The reform converts universities from knowledge institutions into industrial-policy instruments.
L0092	NON_OBVIOUS_INSIGHTS	item_02	ai-prompting-and-description.md:L2097	Visualize as one stark diagram: “Obsolescence” is functioning as a political classification rather than a neutral labor-market fact.
L0093	NON_OBVIOUS_INSIGHTS	item_03	ai-prompting-and-description.md:L2101	Visualize as one stark diagram: The restructuring may shift graduate unemployment rather than solve it.
L0094	NON_OBVIOUS_INSIGHTS	item_04	ai-prompting-and-description.md:L2105	Visualize as one stark diagram: The policy centralizes technological risk inside the education system.
L0095	NON_OBVIOUS_INSIGHTS	item_05	ai-prompting-and-description.md:L2109	Visualize as one stark diagram: The comparison with the United States understates a shared logic.
L0096	NON_OBVIOUS_INSIGHTS	item_01	ai-prompting-and-description.md:L2172	Visualize as one stark diagram: The export control functioned as an internal denial-of-service attack on the U.S. government.
L0097	NON_OBVIOUS_INSIGHTS	item_02	ai-prompting-and-description.md:L2176	Visualize as one stark diagram: The government is not acting as one coherent sovereign but as competing technical and political organizations.
L0098	NON_OBVIOUS_INSIGHTS	item_03	ai-prompting-and-description.md:L2180	Visualize as one stark diagram: The model’s defensive value may be inseparable from the capability that makes it politically alarming.
L0099	NON_OBVIOUS_INSIGHTS	item_04	ai-prompting-and-description.md:L2184	Visualize as one stark diagram: Political language converted a controlled evaluation into an imagined autonomous attack.
L0100	NON_OBVIOUS_INSIGHTS	item_05	ai-prompting-and-description.md:L2188	Visualize as one stark diagram: Anthropic’s conflict with the Pentagon has made capability assessment inseparable from procurement politics.
L0101	NON_OBVIOUS_INSIGHTS	item_01	ai-prompting-and-description.md:L2251	Visualize as one stark diagram: Agentic coding can increase individual output while reducing the organization’s collective intelligence.
L0102	NON_OBVIOUS_INSIGHTS	item_02	ai-prompting-and-description.md:L2255	Visualize as one stark diagram: Loneliness is an architectural consequence, not merely an employee-wellness side effect.
L0103	NON_OBVIOUS_INSIGHTS	item_03	ai-prompting-and-description.md:L2259	Visualize as one stark diagram: AI may replace apprenticeship before it replaces experts.
L0104	NON_OBVIOUS_INSIGHTS	item_04	ai-prompting-and-description.md:L2263	Visualize as one stark diagram: The new object of peer learning is becoming the harness rather than the craft.
L0105	NON_OBVIOUS_INSIGHTS	item_05	ai-prompting-and-description.md:L2267	Visualize as one stark diagram: AI adoption is becoming a loyalty signal under conditions of employment insecurity.
L0106	NON_OBVIOUS_INSIGHTS	item_01	ai-prompting-and-description.md:L2330	Visualize as one stark diagram: YouTube’s AI problem is not primarily content quality; it is a collapse in the cost of claiming attention.
L0107	NON_OBVIOUS_INSIGHTS	item_02	ai-prompting-and-description.md:L2334	Visualize as one stark diagram: YouTube benefits economically from the same abundance it must publicly restrain.
L0108	NON_OBVIOUS_INSIGHTS	item_03	ai-prompting-and-description.md:L2338	Visualize as one stark diagram: “Keeping it human” can become a branding layer rather than a production standard.
L0109	NON_OBVIOUS_INSIGHTS	item_04	ai-prompting-and-description.md:L2342	Visualize as one stark diagram: AI shifts creative power from production skill toward distribution literacy.
L0110	NON_OBVIOUS_INSIGHTS	item_05	ai-prompting-and-description.md:L2346	Visualize as one stark diagram: Sora’s shutdown is not merely a competitor’s failure; it exposes the hidden cost of generative-video platforms.
L0111	NON_OBVIOUS_INSIGHTS	item_01	ai-prompting-and-description.md:L2409	Visualize as one stark diagram: The bill would turn chatbot providers into quasi-clinical monitoring institutions.
L0112	NON_OBVIOUS_INSIGHTS	item_02	ai-prompting-and-description.md:L2413	Visualize as one stark diagram: Age estimation makes identity inference a condition of ordinary conversation.
L0113	NON_OBVIOUS_INSIGHTS	item_03	ai-prompting-and-description.md:L2417	Visualize as one stark diagram: Parental notification silently assumes that the household is the safest escalation point.
L0114	NON_OBVIOUS_INSIGHTS	item_04	ai-prompting-and-description.md:L2421	Visualize as one stark diagram: Pre-release risk assessment could become a licensing regime without formally being called one.
L0115	NON_OBVIOUS_INSIGHTS	item_05	ai-prompting-and-description.md:L2425	Visualize as one stark diagram: The legislative competition is shaping policy architecture before the harms are precisely defined.
L0116	NON_OBVIOUS_INSIGHTS	item_01	ai-prompting-and-description.md:L2488	Visualize as one stark diagram: The sell-off reveals that AI valuations depend on cheap capital as much as technological capability.
L0117	NON_OBVIOUS_INSIGHTS	item_02	ai-prompting-and-description.md:L2492	Visualize as one stark diagram: Debt financing marks a transition from speculative promise to balance-sheet exposure.
L0118	NON_OBVIOUS_INSIGHTS	item_03	ai-prompting-and-description.md:L2496	Visualize as one stark diagram: Research talent is being treated as a financial asset embedded inside corporations.
L0119	NON_OBVIOUS_INSIGHTS	item_04	ai-prompting-and-description.md:L2500	Visualize as one stark diagram: Market concentration converts company-specific disappointment into macroeconomic instability.
L0120	NON_OBVIOUS_INSIGHTS	item_05	ai-prompting-and-description.md:L2504	Visualize as one stark diagram: The Asian decline shows that the AI trade is an international production system, not a collection of American software companies.
L0121	NON_OBVIOUS_INSIGHTS	item_01	ai-prompting-and-description.md:L2567	Visualize as one stark diagram: High use combined with low trust suggests AI is becoming infrastructure before it becomes legitimate.
L0122	NON_OBVIOUS_INSIGHTS	item_02	ai-prompting-and-description.md:L2571	Visualize as one stark diagram: The gap between personal optimism and social pessimism is a diffusion-of-harm pattern.
L0123	NON_OBVIOUS_INSIGHTS	item_03	ai-prompting-and-description.md:L2575	Visualize as one stark diagram: AI Overviews transform search engines from traffic brokers into answer monopolists.
L0124	NON_OBVIOUS_INSIGHTS	item_04	ai-prompting-and-description.md:L2579	Visualize as one stark diagram: Younger adults’ combination of high adoption and deep concern may reflect coercive proximity rather than enthusiasm.
L0125	NON_OBVIOUS_INSIGHTS	item_05	ai-prompting-and-description.md:L2583	Visualize as one stark diagram: The non-user population is not merely waiting for better onboarding.
L0126	NON_OBVIOUS_INSIGHTS	item_01	ai-prompting-and-description.md:L2646	Visualize as one stark diagram: The contraction of the market gives Alibaba pricing power disguised as a discount.
L0127	NON_OBVIOUS_INSIGHTS	item_02	ai-prompting-and-description.md:L2650	Visualize as one stark diagram: The decisive competitive advantage may be organizational endurance rather than model quality.
L0128	NON_OBVIOUS_INSIGHTS	item_03	ai-prompting-and-description.md:L2654	Visualize as one stark diagram: Unified audio-video generation transfers complexity rather than eliminating it.
L0129	NON_OBVIOUS_INSIGHTS	item_04	ai-prompting-and-description.md:L2658	Visualize as one stark diagram: Identity consistency turns synthetic video from a novelty into an asset-management system.
L0130	NON_OBVIOUS_INSIGHTS	item_05	ai-prompting-and-description.md:L2662	Visualize as one stark diagram: European “sovereignty” may be becoming a compliance geography rather than genuine technological autonomy.
L0131	NON_OBVIOUS_INSIGHTS	item_01	ai-prompting-and-description.md:L2725	Visualize as one stark diagram: AI coding shifts software from owned capability toward metered cognitive infrastructure.
L0132	NON_OBVIOUS_INSIGHTS	item_02	ai-prompting-and-description.md:L2729	Visualize as one stark diagram: The most durable point of control may be the harness rather than the model.
L0133	NON_OBVIOUS_INSIGHTS	item_03	ai-prompting-and-description.md:L2733	Visualize as one stark diagram: Open protocols can redistribute dependency rather than eliminate it.
L0134	NON_OBVIOUS_INSIGHTS	item_04	ai-prompting-and-description.md:L2737	Visualize as one stark diagram: AI infrastructure reverses the historical relationship between labor and tooling.
L0135	NON_OBVIOUS_INSIGHTS	item_05	ai-prompting-and-description.md:L2741	Visualize as one stark diagram: Open infrastructure is also an institutional continuity strategy.
L0136	NON_OBVIOUS_INSIGHTS	item_01	ai-prompting-and-description.md:L2804	Visualize as one stark diagram: Claude Corps is simultaneously a workforce program and a customer-acquisition system.
L0137	NON_OBVIOUS_INSIGHTS	item_02	ai-prompting-and-description.md:L2808	Visualize as one stark diagram: The emerging occupation is less “AI expert” than institutional translator.
